31p4uw,[Advice] Should virgins get tested for STIs and HIV even though they are sexually as fresh as a new born?,http://www.reddit.com/r/sex/comments/31p4uw/advice_should_virgins_get_tested_for_stis_and_hiv/,Pulfer,0,2015-04-06 18:27:04,3,/r/sex/comments/31p4uw/advice_should_virgins_get_tested_for_stis_and_hiv/,NaN,"So after reading around on the sites and then consecutive rabbit holes from there, I have found something that isn't really mentioned in full. I see multiple things about getting regularly tested for STIs and more importantly HIV, but one thing that isn't really stated is whether or not virgins should get these tests. I can see the point of getting one just to have like proof or something, but in my case the most sexual thing I have done with another person is a normal kiss and that was embarrassingly long ago. There is no physical reason why I should have any concern what so ever, but I am still curious on what others say about that topic. For clarification, I am a gay male. "
31pm4s,Are condoms and HIV no longer a concern?,http://www.reddit.com/r/sex/comments/31pm4s/are_condoms_and_hiv_no_longer_a_concern/,[deleted],1,2015-04-06 21:01:56,1,/r/sex/comments/31pm4s/are_condoms_and_hiv_no_longer_a_concern/,NaN,
31s9cn,I'm paranoid about HIV after having anal sex. Any advice?,http://www.reddit.com/r/sex/comments/31s9cn/im_paranoid_about_hiv_after_having_anal_sex_any/,[deleted],1,2015-04-07 12:38:48,1,/r/sex/comments/31s9cn/im_paranoid_about_hiv_after_having_anal_sex_any/,NaN,
31scaf,[Advice] I'm paranoid about HIV after first-time anal sex.,http://www.reddit.com/r/sex/comments/31scaf/advice_im_paranoid_about_hiv_after_firsttime_anal/,[deleted],1,2015-04-07 13:00:08,2,/r/sex/comments/31scaf/advice_im_paranoid_about_hiv_after_firsttime_anal/,NaN,"I'm 31-year-old man who had never been with a man before. I met an older gent online yesterday (48), met up, mutually masturbated, and then had him penetrate me while wearing a condom. There was no seminal fluids on his penis before he put the condom on. He put the tip in, used a bit of lube, moved it about a bit gently, then stopped. 5 minutes all told. We masturbated some more and that was it. No oral, no kissing, and I didn't encounter any of his fluids. We played it safe.

But I did notice a spot of blood on the toilet paper after a bowel movement later that night, likely from the penetration. If there was even a slight amount his fluid on the condom, it's possible to catch something.

He was a man in good health and he told me that he was free of all diseases, and I believe him. He said he had met men online before, but I failed to ask how recently.

My question is, should I look into taking medication right away before the 72 hour window closes? This encounter happened about 30 hours ago. I'm really having a difficult time with this."
31vhvq,HIV research looking for volunteers,http://www.reddit.com/r/sex/comments/31vhvq/hiv_research_looking_for_volunteers/,discreethealth,1,2015-04-08 07:08:13,1,/r/sex/comments/31vhvq/hiv_research_looking_for_volunteers/,NaN,
31vkcg,[Looking for volunteers] HIV research,http://www.reddit.com/r/sex/comments/31vkcg/looking_for_volunteers_hiv_research/,discreethealth,0,2015-04-08 07:27:27,0,/r/sex/comments/31vkcg/looking_for_volunteers_hiv_research/,NaN,"This is a initiative that aims to develop and share freely a herbal cure for HIV in the form of information, so that everyone (even the poor and obscure) can benefit from it. https://np.reddit.com/r/HIVchamp/comments/31ukec/herbal_regime_research_information/"
33vv79,HIV anxiety even after testing negative. Help?,http://www.reddit.com/r/sex/comments/33vv79/hiv_anxiety_even_after_testing_negative_help/,[deleted],1,2015-04-25 20:08:57,1,/r/sex/comments/33vv79/hiv_anxiety_even_after_testing_negative_help/,NaN,
33xp8a,"[question] Toronto, 18M Scared that I might have HIV. initial contact was on April 15, 2015. Urgent Help.",http://www.reddit.com/r/sex/comments/33xp8a/question_toronto_18m_scared_that_i_might_have_hiv/,scaredihavehiv,0,2015-04-26 10:15:04,12,/r/sex/comments/33xp8a/question_toronto_18m_scared_that_i_might_have_hiv/,NaN,"So I am 100% serious right now.  I got a blowjob with a condom on from an Asian Massage parlor in Toronto.  The masseuse brought the condom inside a tissue so how can I be sure that it wasnt poked or sabotoged?   while she was blowing me she was going very slow so as to not tear anything.  the condom was really tight. While I was about to cum, I pushed her head down with my hands (could this have broken the condom).  

Initial contact was april 15.  When should I get tested, is it an ASAP type of deal, or should I wait a while?  what symptoms can I expect?  what is rapid hiv testing?  What I am really scared about is having a false positive and getting very VERY scared.  

Also where are some of the best clinics for getting tested in Toronto.  

Is HIV testing done with blood or saliva?  Is there any place I can talk with someone about HIV risk, I really dont know much.

I just know that getting HIV from oral is very very rare, and that getting it with a condom on is almost unheard of.  

Has there ever been a case in history where someone got hiv with a condom on from oral(bj)?"
33y83n,[question] When should I get tested for HIV? What is the window period,http://www.reddit.com/r/sex/comments/33y83n/question_when_should_i_get_tested_for_hiv_what_is/,[deleted],0,2015-04-26 12:49:26,3,/r/sex/comments/33y83n/question_when_should_i_get_tested_for_hiv_what_is/,NaN,
3402ov,[question] Dating someone that's HIV positive?,http://www.reddit.com/r/sex/comments/3402ov/question_dating_someone_thats_hiv_positive/,[deleted],8,2015-04-26 22:53:33,51,/r/sex/comments/3402ov/question_dating_someone_thats_hiv_positive/,NaN,"Okay, so to be honest, this was a random okcupid question I ran across of.  I never really thought about it but I figured I'd toss it on here.  I'm actually kind of curious about everyone's thoughts.

From what I understand though condoms do provide some protection they are not full proof.  Since HIV is a chronic disease that could potentially be fatal, I would probably not get into a relationship with an HIV infected person.  Though I really don't know much about the topic, sorry if I'm coming off as a complete idiot, but genuinely curious to hear from anyone who is in such a relationship or would be open to it.


"
34c5em,[HIV] So how does contracting HIV/AIDS work?,http://www.reddit.com/r/sex/comments/34c5em/hiv_so_how_does_contracting_hivaids_work/,[deleted],1,2015-04-29 16:41:32,1,/r/sex/comments/34c5em/hiv_so_how_does_contracting_hivaids_work/,NaN,
34c6ul,[Question] So how is HIV/AIDS contracted?,http://www.reddit.com/r/sex/comments/34c6ul/question_so_how_is_hivaids_contracted/,sexedhelpthrow,1,2015-04-29 16:53:39,3,/r/sex/comments/34c6ul/question_so_how_is_hivaids_contracted/,NaN,
34wg6o,[hiv][std] i paid for sex,http://www.reddit.com/r/sex/comments/34wg6o/hivstd_i_paid_for_sex/,Ifedupstupid,17,2015-05-04 20:03:11,16,/r/sex/comments/34wg6o/hivstd_i_paid_for_sex/,NaN,"Young guy travelling in Hong Kong. I went through massage websites half believing it was a person-for-hire page. I ended up having vaginal intercourse with a condom with a Filipino woman. (No oral sex, and I checked the condom afterwards, it was not leaking.) 

I'm filled with regret and scare about STDs (HIV and hep). She wasn't even good at massaging. 

Never again. 

I don't know what to feel or think anymore. 

I am worried. "
35e19m,Odds of getting HIV through heterosexual sex is low? Is this true [self.sex],http://www.reddit.com/r/sex/comments/35e19m/odds_of_getting_hiv_through_heterosexual_sex_is/,[deleted],25,2015-05-09 05:41:43,85,/r/sex/comments/35e19m/odds_of_getting_hiv_through_heterosexual_sex_is/,NaN,"I have never heard of this before. In the African American community, our local radio stations are always playing public service announcements about how black women are the most likely to get infected with HIV/AIDS, but here on Reddit I'm reading the odds of getting it from heterosexual sex is low. Im confused can someone clear this up for me"
364lo1,How do I ask my partner if she has HIV or not? There's a chance she could have it..,http://www.reddit.com/r/sex/comments/364lo1/how_do_i_ask_my_partner_if_she_has_hiv_or_not/,[deleted],1,2015-05-15 19:15:35,1,/r/sex/comments/364lo1/how_do_i_ask_my_partner_if_she_has_hiv_or_not/,NaN,
364mtm,[HIV] How do I ask my partner if she has HIV or not? There's a chance she could have it...,http://www.reddit.com/r/sex/comments/364mtm/hiv_how_do_i_ask_my_partner_if_she_has_hiv_or_not/,[deleted],1,2015-05-15 19:27:47,1,/r/sex/comments/364mtm/hiv_how_do_i_ask_my_partner_if_she_has_hiv_or_not/,NaN,
364nst,[hiv][std] How do I ask my partner if she has HIV or not? There's a chance she has it...,http://www.reddit.com/r/sex/comments/364nst/hivstd_how_do_i_ask_my_partner_if_she_has_hiv_or/,hepahepahepa,1,2015-05-15 19:38:35,6,/r/sex/comments/364nst/hivstd_how_do_i_ask_my_partner_if_she_has_hiv_or/,NaN,"Many years ago I had the opportunity to spend time somewhere and do some work where HIV/AIDS is highly prevalent (15%-30%.. but statistics are not at all reliable in 3rd world countries). I met a girl there and we got real close but nothing ever happened. I deeply remember regretting not kissing her one night after walking her home.

Well fate has it we have been reunited by studying in the same country. I visited her once and things got REALLY heated (in a good way) and I just went in for the kiss and it was the best I've ever had.

The elephant in the room however, is that given her backround and the fact that I know she was promiscuous last time I saw her several years ago leads me to hesitate. I honestly just stopped visiting her out of fear of HIV and not being able to confront her about whether she has it or not, or other serious STDs.

So, really, how do I go about this? There's a decent language barrier between us, and although I can certainly communicate the question and facts, I am very blunt in general and I'm afraid she'll take it the wrong way. We can only communicate through text or through face to face contact, but she lives 5 hours away. Ideally I'd really like to go do tests with her and get the results back but that could take weeks, right? Ugh..."
364qu2,Freaking out about getting HIV.. Am I just over reacting,http://www.reddit.com/r/sex/comments/364qu2/freaking_out_about_getting_hiv_am_i_just_over/,crapdidimessup,1,2015-05-15 20:11:17,1,/r/sex/comments/364qu2/freaking_out_about_getting_hiv_am_i_just_over/,NaN,
364tbu,"[Advice] Had protected sex with a masseuse, freaking out I have HIV and every other STD on the planet.",http://www.reddit.com/r/sex/comments/364tbu/advice_had_protected_sex_with_a_masseuse_freaking/,compulsiveworrier,0,2015-05-15 20:39:29,13,/r/sex/comments/364tbu/advice_had_protected_sex_with_a_masseuse_freaking/,NaN,"Hello..  Long time reader, first time poster.  Using a throw away for some obvious reasons.
 

TL;DR   Paid for a massage in Singapore, got more than just a massage.  Used protection, still worried about HIV.
  

I was recently on a business trip and wound up at a massage place in Singapore.  

Seemed kind of seedy but didn't think too much of it.  Went in, had a nice massage but then got more than I had bargained for.  Ended up having protected sex with the masseuse.
  
She was very careful to take the condom off -- looking at it, it did not seem to have broken (the reservoir was in tact) and didn't appear to tear or leak.  When I asked her if she was clean, she said yes and that she has been tested, but I don't know if she was just saying that or if she was telling the truth.
  
I'm freaking out about having HIV though!!  
Everything I have read says you can't get HIV through a latex condom but it doesn't seem to be putting my mind at ease.  
I have also read that it's a lot less common for men to get HIV from a woman, but that doesn't seem to help either.
   

Since it has been roughly 7 days, I went in for some STD testing but knowing that the regular tests won't pick up HIV, I scheduled an HIV RNA test (damn expensive too), which supposedly will pick it up at 9 to 11 days.

Am I just over reacting?  Short of destroying my marriage ~ guilt ridden, I told my wife, this has been the worst mistake of my life.  
"
36oyi2,Freaking out about HIV from a toy,http://www.reddit.com/r/sex/comments/36oyi2/freaking_out_about_hiv_from_a_toy/,throwaway579579579,1,2015-05-20 16:51:16,1,/r/sex/comments/36oyi2/freaking_out_about_hiv_from_a_toy/,NaN,
37j5dh,[HIV] Worry about girlfriends past,http://www.reddit.com/r/sex/comments/37j5dh/hiv_worry_about_girlfriends_past/,mozza5,1,2015-05-27 17:31:14,1,/r/sex/comments/37j5dh/hiv_worry_about_girlfriends_past/,NaN,
37lite,Me and my bad life choices: worried about HIV?,http://www.reddit.com/r/sex/comments/37lite/me_and_my_bad_life_choices_worried_about_hiv/,[deleted],1,2015-05-28 07:29:40,1,/r/sex/comments/37lite/me_and_my_bad_life_choices_worried_about_hiv/,NaN,
37lkgm,[Advice] My bad life choices: should I take an HIV test to reassure a girl?,http://www.reddit.com/r/sex/comments/37lkgm/advice_my_bad_life_choices_should_i_take_an_hiv/,[deleted],1,2015-05-28 07:41:45,1,/r/sex/comments/37lkgm/advice_my_bad_life_choices_should_i_take_an_hiv/,NaN,
38d8j0,HIV/Aids paranoia,http://www.reddit.com/r/sex/comments/38d8j0/hivaids_paranoia/,YellowAfrican,1,2015-06-03 06:43:04,1,/r/sex/comments/38d8j0/hivaids_paranoia/,NaN,
38fpv6,[HIV\aids] paranoia,http://www.reddit.com/r/sex/comments/38fpv6/hivaids_paranoia/,YellowAfrican,1,2015-06-03 15:28:24,8,/r/sex/comments/38fpv6/hivaids_paranoia/,NaN,"Ola Reddit, I am 24 years old and recently been in Japan. While in Japan, I went to a Pink Salon this one time. For those not familiar with the term - a Pink Salon is a blowjob bar. You pay a preset amount of cash and you get a blow job. Usually bare back unless you ask otherwise.

So long story short, I got a BJ In one of these pink salons. Now to make things clear - I do not have any good reason to believe I caught anything. This wasn't a shifty underground place and the girl, although not beautiful, did not look like a crack whore. From a little bit of research on the internet, I think it is safe to assume that I will be completely fine.

The reason for my paranoia is somewhat a moral issue - I have learnt that HIV Can be detected only after 3 to 6 months (!). I am about to fly home, after a 3 month trip around Asia and my girlfriend will be waiting for me. I will not be able to live with myself if I somehow get her infected.

Few questions to you guys - If no signs are shown. Is it safe to assume I'm clean? Can a test be made and get accurate results prior to 3 months? Can I do the test in a foreign country and somehow get results by email?
Are any signs supposed to show prior to 3 months?

I believe I might be completely over reacting. I regret this stupid decision very much.

"
39j3x6,Should she get checked for STDs? (specifically HIV),http://www.reddit.com/r/sex/comments/39j3x6/should_she_get_checked_for_stds_specifically_hiv/,[deleted],1,2015-06-11 19:03:17,1,/r/sex/comments/39j3x6/should_she_get_checked_for_stds_specifically_hiv/,NaN,
39q3k6,How to deal with crippling (presumably irrational) HIV anxiety?,http://www.reddit.com/r/sex/comments/39q3k6/how_to_deal_with_crippling_presumably_irrational/,moflock,1,2015-06-13 10:34:34,1,/r/sex/comments/39q3k6/how_to_deal_with_crippling_presumably_irrational/,NaN,
39q5s1,[STI phobia] Dealing with (presumably irrational) HIV anxiety,http://www.reddit.com/r/sex/comments/39q5s1/sti_phobia_dealing_with_presumably_irrational_hiv/,throwawayancora,1,2015-06-13 10:53:49,5,/r/sex/comments/39q5s1/sti_phobia_dealing_with_presumably_irrational_hiv/,NaN,
3a7yss,[HIV] Is stdcheck.com a legitimate service?,http://www.reddit.com/r/sex/comments/3a7yss/hiv_is_stdcheckcom_a_legitimate_service/,Drew65,1,2015-06-17 16:00:08,1,/r/sex/comments/3a7yss/hiv_is_stdcheckcom_a_legitimate_service/,NaN,
3a954j,"[Question] How often do you guys get tested for HIV and other STDs? I understand that there's free clinics like Planned Parenthood, but rarely do I hear amongst my friends and acquaintances that they've gone to one.",http://www.reddit.com/r/sex/comments/3a954j/question_how_often_do_you_guys_get_tested_for_hiv/,i_respondWith_a_song,0,2015-06-17 22:24:56,12,/r/sex/comments/3a954j/question_how_often_do_you_guys_get_tested_for_hiv/,NaN,
3alha0,Where to donate money to AIDS/HIV NPO in Japan?,http://www.reddit.com/r/sex/comments/3alha0/where_to_donate_money_to_aidshiv_npo_in_japan/,[deleted],1,2015-06-21 04:07:38,1,/r/sex/comments/3alha0/where_to_donate_money_to_aidshiv_npo_in_japan/,NaN,
3alhuv,[Question] Where to donate money to AIDS/HIV NPO in Japan?,http://www.reddit.com/r/sex/comments/3alhuv/question_where_to_donate_money_to_aidshiv_npo_in/,[deleted],2,2015-06-21 04:19:28,1,/r/sex/comments/3alhuv/question_where_to_donate_money_to_aidshiv_npo_in/,NaN,
3aqldk,Need a title for HIV Testing Day event,http://www.reddit.com/r/sex/comments/3aqldk/need_a_title_for_hiv_testing_day_event/,Vomnember,1,2015-06-22 11:33:08,1,/r/sex/comments/3aqldk/need_a_title_for_hiv_testing_day_event/,NaN,
3arj4a,"Paranoid, stress and scared [STD/HIV]",http://www.reddit.com/r/sex/comments/3arj4a/paranoid_stress_and_scared_stdhiv/,[deleted],3,2015-06-22 15:46:15,8,/r/sex/comments/3arj4a/paranoid_stress_and_scared_stdhiv/,NaN,"So on on 6/5 I had sex with a girl. Oral was unprotected, penetration was protected. I'm just paranoid I have hiv. A week later I had a headache, off feeling throat and felt tired. This Friday will mark three and weeks and I don't know if I should head to a clinic or get oraquick or whatever. The waiting is killing me and I just want to know my status. She had no visible signs of anything, but I understand that there doesn't have to be a flare up of anything to indicate any real issues.

TL;DR: had a hook up 6/5, unprotected oral, protected penetration, paranoid I have something since I felt off a week later "
3ayzza,False Positive HIV Diagnosis?,http://www.reddit.com/r/sex/comments/3ayzza/false_positive_hiv_diagnosis/,[deleted],1,2015-06-24 10:09:51,1,/r/sex/comments/3ayzza/false_positive_hiv_diagnosis/,NaN,
3azd86,[Question] False HIV Positive Diagnosis?,http://www.reddit.com/r/sex/comments/3azd86/question_false_hiv_positive_diagnosis/,[deleted],1,2015-06-24 11:46:10,0,/r/sex/comments/3azd86/question_false_hiv_positive_diagnosis/,NaN,
3btrd6,[STD Testing] Wondering if anyone knows how an HIV/STD panel will show up on parents' insurance?,http://www.reddit.com/r/sex/comments/3btrd6/std_testing_wondering_if_anyone_knows_how_an/,unladenswallow__,12,2015-07-01 19:08:10,47,/r/sex/comments/3btrd6/std_testing_wondering_if_anyone_knows_how_an/,NaN,"I've had sex unprotected twice (I'm fully aware how stupid that is and I'm still mad at myself) and I want to get checked because I have this horrible fear that I somehow contracted HIV. Problem is, my parents are SUPER conservative. Like, to the point that they are still mad I drink coffee (Mormons, what can I say?), let alone if they ever knew I was sexually active. We have really good insurance here in California so I'd like to go through that to get the panel done but I'm wondering if there's any possible way it'd show up on any forms they get? I know my medical history is private now that I'm over 18, but if they get any info about this happening there's a whole world of hurt in store for me. 

Thanks! "
3cjlf2,"Condom slipped off with one night stand, freaking out about HIV",http://www.reddit.com/r/sex/comments/3cjlf2/condom_slipped_off_with_one_night_stand_freaking/,[deleted],1,2015-07-08 05:30:59,1,/r/sex/comments/3cjlf2/condom_slipped_off_with_one_night_stand_freaking/,NaN,
3cjmg1,Scared about possibility of HIV after one night stand. Freaking out.,http://www.reddit.com/r/sex/comments/3cjmg1/scared_about_possibility_of_hiv_after_one_night/,Scaredabroad123,1,2015-07-08 05:41:23,1,/r/sex/comments/3cjmg1/scared_about_possibility_of_hiv_after_one_night/,NaN,
3cypt3,Guy Lied About His HIV Status. Now Scared,http://www.reddit.com/r/sex/comments/3cypt3/guy_lied_about_his_hiv_status_now_scared/,throwawaycompost24,1,2015-07-11 17:04:18,1,/r/sex/comments/3cypt3/guy_lied_about_his_hiv_status_now_scared/,NaN,
3cysfi,[Question] [Advice] Guy Lied About His HIV Status. Now Scared,http://www.reddit.com/r/sex/comments/3cysfi/question_advice_guy_lied_about_his_hiv_status_now/,throwawaycompost24,7,2015-07-11 17:30:11,13,/r/sex/comments/3cysfi/question_advice_guy_lied_about_his_hiv_status_now/,NaN,"This happened about 48 hours ago. I matched with a guy on tinder, he seemed sweet, and he wanted to meet up in person. We actually do go meet up, walk through some museums, and we had a pretty good time together. We ate lunch together, and I complained how my back hurts from running. We later agreed to go to his place because he took a class in massages. Later in his place, he told me to take off my pants for the massage and before I did so, I asked him repeatedly does he have any STD's or any sexually transmissible hazards I should be aware about. Again, I asked him this MULTIPLE times. Again and again, he denied having such. Things got pretty tense and he ended up blowing me. He also got a little bit of some cum and precum on his hand and he later fingered me without washing his hand. I also later gave him a hand job. This intercourses were all without condoms. So as I left, I asked him AGAIN if he had any STD/STI's and again, he again said no. Fast forward two days later, I texted him once more asking about if he has HIV. After a long discussion, he admits he had HIV and I flipped the fuck out. I was upset for many reasons. (1) I was upset he lied to me; he could have just told the truth and we still could have gotten along just fine, just taken a little more precautions. (2) It made me furious how he so recklessly was jeopardizing someone else's health just because he was ""in the moment."" He even told me I seemed so frightened about HIV that he figured it was not the right time to discuss it with you. I wish he told me that before the intercourse. He played some mind tricks on me saying how ""it hurts that how he wasn't trusted."" I'm not falling into that bullshit. I guess what I'm wondering is what are the chances I contracted HIV and when should I get tested? I can't get PeP because it's too expensive and I heard it has horrible side effects. Plus, all clinics are closed by now and tomorrow is Sunday (all clinics are pretty much closed) which will make it 72 hours. He told me he was undetectable so even if we did stuff like bareback the chances of me getting it is like .01%. I'm super furious right now and I have no idea what to do. Please help.

TL;DR: Guy said he had no STD/STI or anything of that nature. I trusted him; he gave me a blowjob and fingered me with fingers that had his cum and precum on it. I also gave him a handjob. He later tells me he is positive but undetectable as if that is a way to somewhat justify him lying about his status.

EDIT: I don't know if this helps or not, but sometimes when I wipe my but with toilet paper, blood sometimes gets on it. I think this indicates a cut or open wound inside my anus. Will this increase my chances of contracting HIV?"
3d1f2x,[Question] [Advice] Guy Lied About His HIV Status Update (Herpes),http://www.reddit.com/r/sex/comments/3d1f2x/question_advice_guy_lied_about_his_hiv_status/,throwawaycompost24,1,2015-07-12 11:57:51,5,/r/sex/comments/3d1f2x/question_advice_guy_lied_about_his_hiv_status/,NaN,"
I feel like I'm learning more and more awful secrets about him everyday. This partner told me ""I got the vaccinations for genital herpes since I found out I was positive. It is one shot every 3 months and I finished my last at my January 2015 check up."" He also later told me that he tested negative for the herpes (May 2015) and though he is immune to herpes he is still not herpes free. He also said at this point transmission was impossible. Can I trust him? Again, this is male to male contact, and no condoms. We did fingering with cum on his fingers, he blew me, and we did some penis to penis frotting. He also did peck me on the lips. I also did not take PeP as it was too costly."
3f5fvb,"[Question][Serious] If a man received blowjobs from mutiple women there is no risk for HIM to get HIV or an STD, right?",http://www.reddit.com/r/sex/comments/3f5fvb/questionserious_if_a_man_received_blowjobs_from/,[deleted],0,2015-07-30 04:59:50,7,/r/sex/comments/3f5fvb/questionserious_if_a_man_received_blowjobs_from/,NaN,
3fieqj,Possible contact with HIV?,http://www.reddit.com/r/sex/comments/3fieqj/possible_contact_with_hiv/,[deleted],1,2015-08-02 07:32:03,1,/r/sex/comments/3fieqj/possible_contact_with_hiv/,NaN,
