Post ID,Title,Url,Author,Score,Publish Date,Total No. of Comments,Permalink,Flair,body
avc9c,Kenya Establishes HIV Court to Combat Discrimination,http://carnalnation.com/content/46368/4/kenya-establishes-hiv-court-combat-discrimination,artsake,0,2010-01-28 10:37:16,0,/r/sex/comments/avc9c/kenya_establishes_hiv_court_to_combat/,NaN,
bntky,Study: Sustained HIV Treatment Reduces Risk of Sexual Transmission,http://carnalnation.com/content/52202/4/study-sustained-hiv-treatment-reduces-transmission-risk,artsake,0,2010-04-07 13:49:33,0,/r/sex/comments/bntky/study_sustained_hiv_treatment_reduces_risk_of/,NaN,
buu25,Porn &amp; HIV: AIM's Sharon Mitchell on Becoming a Target for Demonstrators (Video),http://carnalnation.com/content/53434/10/sharon-mitchell-becoming-target-demonstrators-video,artsake,4,2010-04-22 15:12:21,0,/r/sex/comments/buu25/porn_hiv_aims_sharon_mitchell_on_becoming_a/,NaN,
bx09f,China Lifts Ban on HIV+ Visitors,http://carnalnation.com/content/53884/4/china-lifts-ban-hiv-visitors,artsake,0,2010-04-27 18:15:11,0,/r/sex/comments/bx09f/china_lifts_ban_on_hiv_visitors/,NaN,
c49zb,Judge Rules Topping Not a 'Significant Risk' for HIV Infection,http://carnalnation.com/content/55580/4/judge-rules-topping-not-significant-risk-hiv-infection,artsake,1,2010-05-14 16:40:49,0,/r/sex/comments/c49zb/judge_rules_topping_not_a_significant_risk_for/,NaN,
c7p0t,Uzbek Man Jailed for Seven Years for HIV Prevention Efforts,http://carnalnation.com/content/56253/4/uzbek-man-jailed-seven-years-hiv-prevention-efforts,artsake,1,2010-05-24 15:17:55,0,/r/sex/comments/c7p0t/uzbek_man_jailed_for_seven_years_for_hiv/,NaN,
c81fa,New Research: Using Lube for Anal Sex May Increase STI &amp; HIV Risk,http://carnalnation.com/content/56343/4/new-research-using-lube-anal-sex-may-increase-sti-hiv-risk,ScarletLetterSF,4,2010-05-25 13:08:00,3,/r/sex/comments/c81fa/new_research_using_lube_for_anal_sex_may_increase/,NaN,
c84tj,"You should know: Using lube during anal sex increases risk of sexually transmitted infection, including HIV; KY Jelly most damaging",http://latimesblogs.latimes.com/booster_shots/2010/05/lubricants-may-increase-risk-of-anal-sex-studies-show.html,sadax,0,2010-05-25 19:03:07,5,/r/sex/comments/c84tj/you_should_know_using_lube_during_anal_sex/,NaN,
cc6ww,Unprotected anal sex ups HIV risk 20-fold ,http://sify.com/news/unprotected-anal-sex-ups-hiv-risk-20-fold-news-international-kf0qEcicdif.html,ChadLeNose,2,2010-06-06 21:23:44,2,/r/sex/comments/cc6ww/unprotected_anal_sex_ups_hiv_risk_20fold/,NaN,
cgdag,Prostitution Unlikely To Cause HIV Epidemics,http://feeds.technologyreview.com/click.phdo?i=244a32346ee37fd377d4a77f737f2662,Vailhem,17,2010-06-18 04:52:29,3,/r/sex/comments/cgdag/prostitution_unlikely_to_cause_hiv_epidemics/,NaN,
cisw6,"After conclusively learning that HIV cannot possibly cause immunodeficiency, I'm becoming increasingly suspicious that other so-called ""STDs"" or ""STIs"" are simply misattributed symptoms, and are noncontagious.  Somebody please prove me wrong.  Pictures will not do, I need proof of causality.",https://www.reddit.com/r/sex/comments/cisw6/after_conclusively_learning_that_hiv_cannot/,ghibmmm,0,2010-06-24 20:29:35,68,/r/sex/comments/cisw6/after_conclusively_learning_that_hiv_cannot/,NaN,"Please do not link to abstracts.  Full articles only.

I need proof that a *healthy* host (that is, with an *uncompromised immune system*) can receive an infectious agent, sexually or through other interpersonal contact, and begin to exhibit symptoms.

I didn't start this thread to argue, so don't expect me to say anything."
clgq8,Anal Sex 18 Times More Likely to Transmit HIV Than Vaginal Sex,http://carnalnation.com/content/57580/4/anal-sex-18-times-more-likely-transmit-hiv-vaginal-sex,artsake,48,2010-07-02 15:26:42,87,/r/sex/comments/clgq8/anal_sex_18_times_more_likely_to_transmit_hiv/,NaN,
cml9e,Man Wins $1.25 Mil Judgment Against Doctor Who Disclosed His HIV Status,http://carnalnation.com/content/57636/4/man-wins-125-mil-judgment-against-doctor-who-disclosed-his-hiv-status,artsake,2,2010-07-06 12:13:28,2,/r/sex/comments/cml9e/man_wins_125_mil_judgment_against_doctor_who/,NaN,
cmp1s,Man Wins $1.25M Judgment Against Doctor Who Disclosed His HIV Status,http://carnalnation.com/content/57636/4/man-wins-125m-judgment-against-doctor-who-disclosed-his-hiv-status,ScarletLetterSF,1,2010-07-06 18:16:07,0,/r/sex/comments/cmp1s/man_wins_125m_judgment_against_doctor_who/,NaN,
cnhu2,Scientists Discover Antibody That Neutralizes 91% of HIV Strains,http://carnalnation.com/content/57739/4/scientists-discover-antibody-neutralizes-91-hiv-strains,artsake,183,2010-07-08 16:57:45,29,/r/sex/comments/cnhu2/scientists_discover_antibody_that_neutralizes_91/,NaN,
cnvu8,HIV resistance – should we fear a super-bug?,http://pwn.bc.ca/2010/07/hiv-resistancesuper-bug/,MiriamPWN,1,2010-07-09 15:55:25,0,/r/sex/comments/cnvu8/hiv_resistance_should_we_fear_a_superbug/,NaN,
cosi7,"Obama Promises to Slow Spread of HIV, Increase Care",http://carnalnation.com/content/57805/4/obama-promises-slow-spread-hiv-increase-care,artsake,0,2010-07-12 14:38:01,0,/r/sex/comments/cosi7/obama_promises_to_slow_spread_of_hiv_increase_care/,NaN,
coy83,"Poor-Fitting Condoms &amp; Small Penises Hampering Fight Against HIV In India: ""A survey in India has concluded that condoms made according to international sizes are too large for Indian men... more than half of the men measured had penises that were shorter than international standards for condoms.""",http://news.bbc.co.uk/2/hi/6161691.stm,alecb,3,2010-07-13 00:15:01,7,/r/sex/comments/coy83/poorfitting_condoms_small_penises_hampering_fight/,NaN,
cp54d,White House Unveils New National HIV/AIDS Strategy,http://carnalnation.com/content/57830/4/white-house-unveils-new-national-hivaids-strategy,artsake,0,2010-07-13 11:14:39,1,/r/sex/comments/cp54d/white_house_unveils_new_national_hivaids_strategy/,NaN,
crcay,New Vaginal Gel Reduces HIV Infection by 54 Percent,http://carnalnation.com/content/57990/4/new-vaginal-gel-reduces-hiv-infection-54-percent,artsake,4,2010-07-19 13:10:36,0,/r/sex/comments/crcay/new_vaginal_gel_reduces_hiv_infection_by_54/,NaN,
cv92t,Is the New HIV Vaginal Microbicide Gel Sexist? Does It Make Women the Responsible Ones AGAIN - first birth control now HIV prevention?,http://carnalnation.com/content/58174/4/new-hiv-microbicide-gel-sexist,artsake,0,2010-07-29 14:58:32,5,/r/sex/comments/cv92t/is_the_new_hiv_vaginal_microbicide_gel_sexist/,NaN,
d5onm,German Pop Star Benaissa Handed Suspended Sentence over HIV Sex,http://rowlands.maars.net/?p=2375,horowlands,0,2010-08-26 05:29:44,2,/r/sex/comments/d5onm/german_pop_star_benaissa_handed_suspended/,NaN,
d6qa8,German singer Nadja Benaissa sentenced for infecting lover with HIV,http://www.guardian.co.uk/world/2010/aug/26/nadja-benaissa-hiv-sentence-germany,salvage,6,2010-08-28 19:05:23,1,/r/sex/comments/d6qa8/german_singer_nadja_benaissa_sentenced_for/,NaN,
daoh7,STD Testing | Same Day STD Testing | Confidential STD Testing | HIV Testing,http://www.nationalstdtesting.com,nationalstdtesting,1,2010-09-07 09:40:33,1,/r/sex/comments/daoh7/std_testing_same_day_std_testing_confidential_std/,NaN,
daqcl,New York STD Testing | HIV PCR Testing | Confidential NYC Testing,http://www.newyork-stdtesting.com,nationalstdtesting,0,2010-09-07 11:47:58,0,/r/sex/comments/daqcl/new_york_std_testing_hiv_pcr_testing_confidential/,NaN,
daw1n,Jacksonville Same Day STD Testing | HIV Testing,http://www.stdtesting-jacksonville.com,nationalstdtesting,0,2010-09-07 18:50:03,0,/r/sex/comments/daw1n/jacksonville_same_day_std_testing_hiv_testing/,NaN,
dawe0,Phoenix Same Day STD Testing | HIV Testing,http://www.stdtesting-phoenix.com,nationalstdtesting,1,2010-09-07 19:16:22,1,/r/sex/comments/dawe0/phoenix_same_day_std_testing_hiv_testing/,NaN,
dax56,Philadelphia Same Day STD Testing | HIV Testing,http://www.stdtesting-philadelphia.com,NHTBlossom,1,2010-09-07 20:11:31,0,/r/sex/comments/dax56/philadelphia_same_day_std_testing_hiv_testing/,NaN,
dfsvb,Sex-Positive Countries Have Some of the Lowest Instances of STDs &amp; HIV ,http://dodsonandross.com/blogs/palesa/2010/09/sex-positive-countries-have-some-lowest-instances-stis-hiv,ohstrangeone,118,2010-09-18 17:58:24,15,/r/sex/comments/dfsvb/sexpositive_countries_have_some_of_the_lowest/,NaN,
di26x,"UPDATE 1-1 in 5 gay, bisexual men in US cities has 
HIV
| Reuters",http://www.reuters.com/article/idCNN2315623720100923?rpc=44,MrFlagg,0,2010-09-23 15:41:59,13,/r/sex/comments/di26x/update_11_in_5_gay_bisexual_men_in_us_cities_has/,NaN,
dqior,California porn actor tests positive for HIV,http://tecblog.tecdiary.com/entertainment/california-porn-actor-tests-positive-for-hiv.html,tecdiary,1,2010-10-12 21:24:35,0,/r/sex/comments/dqior/california_porn_actor_tests_positive_for_hiv/,NaN,
dqub4,Los Angeles porn actor tests positive for HIV - mad scramble now on yo find exposed partners...,http://ca.news.yahoo.com/s/capress/101013/entertainment/us_porn_industry_hiv,[deleted],1,2010-10-13 13:42:50,0,/r/sex/comments/dqub4/los_angeles_porn_actor_tests_positive_for_hiv_mad/,NaN,[deleted]
dquj8,Los Angeles porn actor tests positive for HIV - mad scramble on to find exposed partners...,http://ca.news.yahoo.com/s/capress/101013/entertainment/us_porn_industry_hiv,[deleted],1,2010-10-13 13:57:00,0,/r/sex/comments/dquj8/los_angeles_porn_actor_tests_positive_for_hiv_mad/,NaN,[deleted]
dqvc4,Los Angeles porn actor tests positive for HIV - mad scramble on to find exposed partners...,http://ca.news.yahoo.com/s/capress/101013/entertainment/us_porn_industry_hiv,[deleted],1,2010-10-13 14:52:09,0,/r/sex/comments/dqvc4/los_angeles_porn_actor_tests_positive_for_hiv_mad/,NaN,[deleted]
dqvv1,Los Angeles porn actor tests positive for HIV - mad scramble on to find exposed partners...,http://ca.news.yahoo.com/s/capress/101013/entertainment/us_porn_industry_hiv,RedditLovesYou,1,2010-10-13 15:34:58,1,/r/sex/comments/dqvv1/los_angeles_porn_actor_tests_positive_for_hiv_mad/,NaN,
dr900,Should anyone even care about the porn industry's HIV crisis?,http://goodmenproject.com/2010/10/14/porn-another-four-letter-word/,rwohan,13,2010-10-14 10:37:57,12,/r/sex/comments/dr900/should_anyone_even_care_about_the_porn_industrys/,NaN,
dvldg,Research and Mentorship Program (RAMP) Scholar Grants from HIV Vaccine Trial Network | Daily Scholarships,http://enyila.info/medical/research-and-mentorship-program-ramp-scholar-grants-from-hiv-vaccine-trial-network/,drnyol,1,2010-10-24 01:05:39,1,/r/sex/comments/dvldg/research_and_mentorship_program_ramp_scholar/,NaN,
dwt1z,HIV DNA by PCR Testing | Confidential Same Day Testing,http://www.hivdnabypcrtesting.com,nationalstdtesting,1,2010-10-26 13:33:53,0,/r/sex/comments/dwt1z/hiv_dna_by_pcr_testing_confidential_same_day/,NaN,
dy5di,Have I got HIV?,http://www.freedomhealth.co.uk/,JosephLewis,0,2010-10-29 01:20:39,5,/r/sex/comments/dy5di/have_i_got_hiv/,NaN,
dzgvs,So I may have been exposed to HIV... Help please,https://www.reddit.com/r/sex/comments/dzgvs/so_i_may_have_been_exposed_to_hiv_help_please/,paranoia111,0,2010-11-01 05:53:56,11,/r/sex/comments/dzgvs/so_i_may_have_been_exposed_to_hiv_help_please/,NaN,"This may be graphic so please, bear with me.

About 3 weeks ago, I met this guy and we got together to ""play.""  We did not have oral sex.  We did not kiss, nor any other contact except we fisted each other.  We used gloves, and used a clean paper towel to transfer lube to our gloves to minimize cross-contamination.  I fisted him, he fisted me.  I did touch his penis for a short time with no gloves when I was fisted by him.  I then fisted him again (again, with gloves) until he ejaculated (on to a towel) after masturbating himself.  I myself did not ejaculate.  

He just called me today morning to tell me that he recently learned that he was HIV positive.  How worried should I be about me being infected somehow?  We're both pretty sure the lube never was cross contaminated, nor our gloves but I'm freaking out.  Please help :("
e56my,Is there a better way to use punishment to stop the spread of HIV?,http://bigthink.com/ideas/24938,dollarsandsex,0,2010-11-12 08:23:06,2,/r/sex/comments/e56my/is_there_a_better_way_to_use_punishment_to_stop/,NaN,
e8996,The HIV Law Bible (compilation of all US state laws regarding HIV),http://www.advocate.com/News/Daily_News/2010/11/17/The_HIV_Law_Bible/?utm_source=feedburner&amp;utm_medium=feed&amp;utm_campaign=Feed%3A+AdvocatecomDailyNews+%28Advocate.com+Daily+News%29,zomboi,1,2010-11-18 11:42:17,0,/r/sex/comments/e8996/the_hiv_law_bible_compilation_of_all_us_state/,NaN,
eaqr5,How To Find HIV PCR Testing,http://hubpages.com/hub/How-To-Find-HIV-PCR-Testing,nationalstdtesting,1,2010-11-23 13:27:26,0,/r/sex/comments/eaqr5/how_to_find_hiv_pcr_testing/,NaN,
ebdkm,Suggestions for dirty talk - My SO has HIV ,https://www.reddit.com/r/sex/comments/ebdkm/suggestions_for_dirty_talk_my_so_has_hiv/,[deleted],23,2010-11-24 15:52:15,67,/r/sex/comments/ebdkm/suggestions_for_dirty_talk_my_so_has_hiv/,NaN,[deleted]
eeg3l,12 Myths And Facts About HIV And AIDS,http://morningquickie.com/2009/11/30/hiv-aids-myths/,MorningQuickie,1,2010-12-01 03:19:05,1,/r/sex/comments/eeg3l/12_myths_and_facts_about_hiv_and_aids/,NaN,
eeg99,HIV Is Women's Business,http://morningquickie.com/2010/12/01/hiv-is-womens-business/,MorningQuickie,1,2010-12-01 03:34:07,1,/r/sex/comments/eeg99/hiv_is_womens_business/,NaN,
efv3a,Can you HIV me some anal?,http://damnyouautocorrect.com/2338/special-request/,tjpoe,0,2010-12-03 14:55:50,0,/r/sex/comments/efv3a/can_you_hiv_me_some_anal/,NaN,
ei4uo,Porn performer calls for mandatory condom use after he tests positive for HIV.,http://latimesblogs.latimes.com/lanow/2010/12/porn-performer-who-tested-hiv-positive-speaks-out.html,swimgurl,219,2010-12-07 22:27:12,113,/r/sex/comments/ei4uo/porn_performer_calls_for_mandatory_condom_use/,NaN,
eidbq,HIV-positive porn performer speaks out...,"http://www.latimes.com/health/la-me-porn-hiv-20101208,0,5306958.story",[deleted],4,2010-12-08 09:01:37,1,/r/sex/comments/eidbq/hivpositive_porn_performer_speaks_out/,NaN,
eikkb,HIV-positive porn actor: Mandate condoms,http://www.salon.com/entertainment/movies/pornography/index.html?story=/mwt/broadsheet/2010/12/08/porn_condoms,juiceheads,0,2010-12-08 15:05:32,0,/r/sex/comments/eikkb/hivpositive_porn_actor_mandate_condoms/,NaN,
env1c,Girl who knows Dani Filths Girlfriend (Cradle of Filth) told me that she said he is HIV + and she is too,https://www.reddit.com/r/sex/comments/env1c/girl_who_knows_dani_filths_girlfriend_cradle_of/,[deleted],1,2010-12-18 02:02:49,0,/r/sex/comments/env1c/girl_who_knows_dani_filths_girlfriend_cradle_of/,NaN,[deleted]
ep1ql,My SO is at risk for testing positive for HIV.  ,https://www.reddit.com/r/sex/comments/ep1ql/my_so_is_at_risk_for_testing_positive_for_hiv/,[deleted],41,2010-12-20 16:29:34,62,/r/sex/comments/ep1ql/my_so_is_at_risk_for_testing_positive_for_hiv/,NaN,[deleted]
f1sg5,HIV in the UK - Time to Test!,http://drbonar.typepad.com,zengrifter,0,2011-01-13 13:01:32,0,/r/sex/comments/f1sg5/hiv_in_the_uk_time_to_test/,NaN,
f8h00,Air Force Sgt. David Gutierrez Sentenced For Unprotected HIV+ Sex,http://guanabee.com/2011/01/david-gutierrez-court-martial/,BrianGriffin2012,11,2011-01-24 18:39:11,2,/r/sex/comments/f8h00/air_force_sgt_david_gutierrez_sentenced_for/,NaN,
fflk9,"Had unprotected sex, do I have to wait 6 months to take an HIV test? ",http://www.reddit.com/r/sex/comments/fflk9/had_unprotected_sex_do_i_have_to_wait_6_months_to/,[deleted],1,2011-02-04 19:25:19,30,/r/sex/comments/fflk9/had_unprotected_sex_do_i_have_to_wait_6_months_to/,NaN,"I am really freaked out.  It was a stupid mistake made in the ""heat of the moment.""  I actually had been carrying condoms around with me for a week anticipating some sex, and stupidly washed them in my jeans the day it finally happened.  Anyway I should have just stopped everything, gone downstairs to the CVS and gotten some rubbers BUT at the moment it seemed really important that I get in it ASAP.

She is a young girl (20) but I am worried that she might have had unprotected sex with a lot of other men.  It didn't phase her at all when I said I didn't have any condoms, she just told me to put it in.  

We don't even talk anymore.  The ""relationship"" was over a week later (this is about 3 weeks ago now). 

Anyway I had heard that you need to wait 6 months before an HIV test will be effective, is that true?

**tl:dr: stupidly fucked a girl I barely knew without a condom, worried, need to know about HIV testing.**
"
fo3i0,"The U.S. House of Representatives has just voted to bar Planned Parenthood health centers from all federal funding for birth control, cancer screenings, HIV testing, and other lifesaving care. ",https://secure.ppaction.org/site/SPageServer?pagename=pp_ppol_ws_I_Stand_with_PP,mysexytimeacct,709,2011-02-18 12:13:44,295,/r/sex/comments/fo3i0/the_us_house_of_representatives_has_just_voted_to/,NaN,
gd72n,PSA: The 5 fluids that transmit HIV ,http://vimeo.com/21083101,imakitty,11,2011-03-28 08:42:27,7,/r/sex/comments/gd72n/psa_the_5_fluids_that_transmit_hiv/,NaN,
gfh2g,FAQ 19.4. – STIs: I had unprotected sex.  Do I have HIV/AIDS?,http://www.reddit.com/r/sex/comments/gfh2g/faq_194_stis_i_had_unprotected_sex_do_i_have/,patientpolyamorist,0,2011-03-31 05:09:50,3,/r/sex/comments/gfh2g/faq_194_stis_i_had_unprotected_sex_do_i_have/,NaN,I had unprotected sex with a huge slut.  Do I have HIV?  
gxz3y,Today and Friday in Colorado: $10 Chlamydia/Gonorrhea and $10 HIV testing at Planned Parenthood,http://www.plannedparenthood.org/rocky-mountains/omg-gyt-36574.htm,[deleted],122,2011-04-26 11:48:44,27,/r/sex/comments/gxz3y/today_and_friday_in_colorado_10/,NaN,
ha0s5,Anti-retroviral drugs 'help reduce' HIV transmission,http://www.bbc.co.uk/news/health-13381292,takamata,2,2011-05-12 13:02:28,0,/r/sex/comments/ha0s5/antiretroviral_drugs_help_reduce_hiv_transmission/,NaN,
hbp2n,Is it HIV?,http://www.reddit.com/r/sex/comments/hbp2n/is_it_hiv/,[deleted],8,2011-05-14 22:42:16,23,/r/sex/comments/hbp2n/is_it_hiv/,NaN,"I'm sure there are dozens of posts like this but I just need something to calm me down.  Yes I am going to go get tested.  6 weeks ago I had a protected (I wore a condom) one night stand.  For the past 4-5 days I have had a stuffed up nose, ears, sore throat, cough, but no body aches or anything like that.  Read that ""flu like"" symptoms could be the first sign of HIV.  I took the condom off to finish and don't know if some of her ""fluid"" could have gotten on me.  Am I just being really paranoid?  I'm not sure of her sexual history or risk factor.  Thank you."
hk3nc,"I need information/advice for male STD testing (full suite, not just HIV).",http://www.reddit.com/r/sex/comments/hk3nc/i_need_informationadvice_for_male_std_testing/,throwawaystdtesting,8,2011-05-25 14:05:07,14,/r/sex/comments/hk3nc/i_need_informationadvice_for_male_std_testing/,NaN,"Background: Male/30/straight.  Multiple partners.  90% condom use.  Not currently covered by health insurance.  

I'd like to get tested for the top 6-10 STDs.  Urine test + blood test and whatever else would be necessary.  When I've gone to clinics in the past, they tell me they can't test for everything, especially if I'm asymptomatic.  Not sure how accurate that is.

Google seems to have too much static on the subject, especially for guys.  Willing to spend money, I just don't want to shell out unnecessarily.  I don't have a doctor that I see for checkups or anything.  Greater LA area if that matters.

What should I be looking for out of clinics/ doctors?  What should I expect as far as cost, turnaround, actual exams?  Getting a good test would let me know, and potentially keep me from screwing up someone else's life.

This may have been covered previously.  If so, please link me to it.  Thanks."
ia7h0,hiv window time period,http://www.reddit.com/r/sex/comments/ia7h0/hiv_window_time_period/,stupidbareback,1,2011-06-27 02:32:41,6,/r/sex/comments/ia7h0/hiv_window_time_period/,NaN,"so, I worry too much, stating that straight out.  now for my little story.

A few weeks ago (3), I got smashed and hooked up with a friend.  wasn't planning on it, didn't have condoms, so was going to just wait for another time but she said ""you could just do it anyway"" and I asked if she's 100% tested up and clean and she said yes (long term friend, someone I generally trust to be honest here).  

anyway.  3 weeks later I get this flu-type thing.  I know my HIV stuff from high school and I go into get a quick test (I get a test every 6 months/in between partners anyway), test shows up negative, but the nurse says that I would be in the window period where I might not test positive.  What I'm wondering is, if I got the flu-like symptoms, would I test positive, or might I still show a false negative?

also, I'm worrying too much, right? 

EDIT: Thanks hivemind, feeling less freaked out now.  Condoms area already stashed in my bag."
ini8g,"Condom broke, she may have HIV. How screwed am I? ",http://www.reddit.com/r/sex/comments/ini8g/condom_broke_she_may_have_hiv_how_screwed_am_i/,[deleted],0,2011-07-12 09:00:42,32,/r/sex/comments/ini8g/condom_broke_she_may_have_hiv_how_screwed_am_i/,NaN,"I was with this woman and she told me that she had a (Male) friend who had sex with a guy who was HIV+. Now she and this guy are both very close, I'm pretty sure they still bang, but I'm not too sure.


The point is, I think she may have HIV and I had sex with her for a bit with a broken, basically removed, condom. 

It was a short period of time, and I washed throughly afterwards. I know that may not help, but what was I supposed to do, I was desperate. 

Essentially, what I'm asking is, what are the odds of having HIV after little exposure? 

Help me reddit, you're my only hope.  "
iuye0,"Study: Male circumcision curbs HIV spread, increases pleasure, does not increase risky behavior",http://sciencespeaksblog.org/2011/07/20/male-circumcision-curbs-spread-of-hiv-over-time-risky-behavior-does-not-increase/,[deleted],0,2011-07-20 09:42:40,44,/r/sex/comments/iuye0/study_male_circumcision_curbs_hiv_spread/,NaN,
j8rjf,"Detect HIV and syphilis in 15min for $1, don't forget about the 3 month rule though!",http://www.fastcompany.com/1770850/the-10-cent-plastic-chip-that-quickly-detect-hiv-syphilis,nestip,7,2011-08-04 06:13:03,1,/r/sex/comments/j8rjf/detect_hiv_and_syphilis_in_15min_for_1_dont/,NaN,
ja8r9,Anxious i might have contracted HIV,http://www.reddit.com/r/sex/comments/ja8r9/anxious_i_might_have_contracted_hiv/,ITriedIt,0,2011-08-05 14:20:28,3,/r/sex/comments/ja8r9/anxious_i_might_have_contracted_hiv/,NaN,"Damnit! my anxiety came up again. can't sleep tonight because i am scared i have contracted HIV from the episode i mentioned in my previous post, where i stated i had finally tried a M/M encounter.

I had sex with him with condom, and then i jerked off with his right hand I THINK, and afterwards he jerked me off and fingered me with his left hand. It was dark outside so i couldn't see his fingers clearly. I am so scared that i have contracted HIV.

I hate being a hypocondriac"
jbyih,Worries about getting HIV. Help?,http://www.reddit.com/r/sex/comments/jbyih/worries_about_getting_hiv_help/,awaymethrowafter,1,2011-08-07 18:16:43,9,/r/sex/comments/jbyih/worries_about_getting_hiv_help/,NaN,"I'll explain what I can. I'm a straight guy who decided to try experimenting with another guy (just to see what topping a guy is like). Met him on Craigslist, and he promised he was clean. We were using a condom, but at some point, it was no longer on my dick. I finished and then we went our separate ways. I then remembered that HIV is a huge worry. I did not notice any blood on the condom or my dick at all, and he used a lot of saliva. He did say he was clean multiple times, but that's on his word. 

Since that incident (a couple days ago), I've been constantly reading up about HIV, and it looks as a top who used a condom at least part of the time with no bleeding, I'm at a lower risk than I would have been if I was bottom. However it's still a risk and it's really weighing down my mind. I plan on getting tested in a couple weeks, then at the six week mark, but until then I still feel very anxious. 

NEVER AGAIN will I make such a stupid mistake. 

Does anyone have any words of wisdom and/or comfort they can share with me? :\"
jztsm,I have no STD symptoms but GF wants me to be tested for the works. I had planned on HIV only but  should I get tested for everything?,http://www.reddit.com/r/sex/comments/jztsm/i_have_no_std_symptoms_but_gf_wants_me_to_be/,mdnash,7,2011-08-30 20:58:31,39,/r/sex/comments/jztsm/i_have_no_std_symptoms_but_gf_wants_me_to_be/,NaN,
k0g0g,Porn Studios Shut Down over HIV Fears,http://www.bbc.co.uk/newsbeat/14729107,Kier18,4,2011-08-31 11:25:55,0,/r/sex/comments/k0g0g/porn_studios_shut_down_over_hiv_fears/,NaN,
k5fr1,Porn performer retests HIV- (w/ discussion of mandating condom use in porn),http://abcnews.go.com/Health/Wellness/porn-performer-retests-hiv-negative-industry-shutdown/story?id=14449747,cryptorchidism,30,2011-09-05 09:17:19,32,/r/sex/comments/k5fr1/porn_performer_retests_hiv_w_discussion_of/,NaN,
lz4vw,Who here has HIV or AIDS and continues to date?,http://www.reddit.com/r/sex/comments/lz4vw/who_here_has_hiv_or_aids_and_continues_to_date/,[deleted],30,2011-11-03 09:36:43,22,/r/sex/comments/lz4vw/who_here_has_hiv_or_aids_and_continues_to_date/,NaN,Just curious
