5phfs5,[hiv][casual sex risks][oral] Being safe or paranoid?,https://www.reddit.com/r/sex/comments/5phfs5/hivcasual_sex_risksoral_being_safe_or_paranoid/,zco_o,2,2017-01-22 07:20:13,15,/r/sex/comments/5phfs5/hivcasual_sex_risksoral_being_safe_or_paranoid/,NaN,"30 / heterosexual / male - I've recently ended long-term reletionship, this resulted in a situation where I have casual sex, yet in a limited way. Let's say - I had 3 partners during last 3 months, with two of them I had only oral sex (without protection) and with the other one - oral sex (without protection) and vaginal sex (with protection). In all cases, these are people I know for some time already, so I've felt more safe and trusting. But recently I started to wonder. Well, did we talk about our HIV status? No, we didn't.  I guess we all silently assumed, that we are negative, we have protection in case of vaginal sex and oral has low chance of transmission. (https://www.cdc.gov/hiv/risk/estimates/riskbehaviors.html)

But my mind recently become full of doubt, well, low is low, not zero. But I've never really gave it a thought. I'm going to get tested. I have to say, I'm nervous about the result. I still wonder how is it possible, that all four of us ignored this issue and assumed ""well it's just oral"". Thinking further, from now on, will I always bring this subject to my potential sexual partners before we start anything? Am I safe or paranoid? How do you deal with that issue?
"
5ps44o,"keep thinking i have hiv, it's crippling",https://www.reddit.com/r/sex/comments/5ps44o/keep_thinking_i_have_hiv_its_crippling/,[deleted],1,2017-01-23 14:17:15,1,/r/sex/comments/5ps44o/keep_thinking_i_have_hiv_its_crippling/,NaN,[removed]
5rhjnv,"[Help][HIV][M28]Had unprotected anal sex (received), with who I later learned was sex worker, should I continue panicking?",https://www.reddit.com/r/sex/comments/5rhjnv/helphivm28had_unprotected_anal_sex_received_with/,[deleted],1,2017-02-01 11:20:50,1,/r/sex/comments/5rhjnv/helphivm28had_unprotected_anal_sex_received_with/,NaN,[removed]
5rhn92,"[Possible HIV risk][M28]Had unprotected anal sex (as receiver), with who I later learned was a sex worker, should I continue panicking?",https://www.reddit.com/r/sex/comments/5rhn92/possible_hiv_riskm28had_unprotected_anal_sex_as/,[deleted],2,2017-02-01 11:36:16,9,/r/sex/comments/5rhn92/possible_hiv_riskm28had_unprotected_anal_sex_as/,NaN,[deleted]
5rlzam,Scared to death that I have [HIV] after [first] sexual experience,https://www.reddit.com/r/sex/comments/5rlzam/scared_to_death_that_i_have_hiv_after_first/,[deleted],1,2017-02-02 02:17:13,1,/r/sex/comments/5rlzam/scared_to_death_that_i_have_hiv_after_first/,NaN,[removed]
5ro1rf,Serious concerns over possible [HIV] exposure,https://www.reddit.com/r/sex/comments/5ro1rf/serious_concerns_over_possible_hiv_exposure/,[deleted],1,2017-02-02 09:16:48,1,/r/sex/comments/5ro1rf/serious_concerns_over_possible_hiv_exposure/,NaN,[removed]
5ro6xf,Severely [stressed] out over possible [HIV exposure] from [first sexual experience],https://www.reddit.com/r/sex/comments/5ro6xf/severely_stressed_out_over_possible_hiv_exposure/,[deleted],1,2017-02-02 09:39:10,1,/r/sex/comments/5ro6xf/severely_stressed_out_over_possible_hiv_exposure/,NaN,[removed]
5robc8,[Sexual Health] Seriously concerned/stressed/full of anxiety that I may have HIV from first sexual experience.,https://www.reddit.com/r/sex/comments/5robc8/sexual_health_seriously_concernedstressedfull_of/,[deleted],1,2017-02-02 09:59:05,1,/r/sex/comments/5robc8/sexual_health_seriously_concernedstressedfull_of/,NaN,[removed]
5shnyw,"[Escort][hiv][sex]Had unprotected oral and intercourse, possibility of hiv?",https://www.reddit.com/r/sex/comments/5shnyw/escorthivsexhad_unprotected_oral_and_intercourse/,Cookiebiscuits,1,2017-02-06 15:07:51,1,/r/sex/comments/5shnyw/escorthivsexhad_unprotected_oral_and_intercourse/,NaN,[removed]
5shq6b,"[hiv][oral sex]Had unprotected oral and intercourse, possibility of hiv?",https://www.reddit.com/r/sex/comments/5shq6b/hivoral_sexhad_unprotected_oral_and_intercourse/,Cookiebiscuits,0,2017-02-06 15:18:23,14,/r/sex/comments/5shq6b/hivoral_sexhad_unprotected_oral_and_intercourse/,NaN,"SO i wanted to get an older escort and i did, she has a strict condom rule but on the last 10-15 minutes she told me i can get raw and i creampie'd her, she only let me in as she knew i was young and std free, what are the chances she has an std? don't know if im allowed to put her number here so you can look her up, 

i have not experienced burning pee sensation or anything effects although i know symptoms cannot appear for a while she claimed she was clean and didn't have anything unusual on her body. paid $200 not sure if that is high end or not. 

Thanks.

EDIT:https://www.theeroticreview.com/reviews/show.asp?id=288752 

Everything is negative, almost 3 weeks with no sores/lesions. Doc said most likely no syphilis or herpes. Bullet dodged, will not repeat ever again."
5v3kpi,Am i at risk of HIV/STDs?,https://www.reddit.com/r/sex/comments/5v3kpi/am_i_at_risk_of_hivstds/,[deleted],1,2017-02-20 01:00:07,1,/r/sex/comments/5v3kpi/am_i_at_risk_of_hivstds/,NaN,[removed]
5v3luv,22 [M] Am i at risk of [HIV] [STD] ??? [Medical],https://www.reddit.com/r/sex/comments/5v3luv/22_m_am_i_at_risk_of_hiv_std_medical/,[deleted],0,2017-02-20 01:10:21,2,/r/sex/comments/5v3luv/22_m_am_i_at_risk_of_hiv_std_medical/,NaN,[deleted]
5vtth3,Risk of HIV with condom too tight (m2m),https://www.reddit.com/r/sex/comments/5vtth3/risk_of_hiv_with_condom_too_tight_m2m/,throwaway13490150980,1,2017-02-23 15:05:34,1,/r/sex/comments/5vtth3/risk_of_hiv_with_condom_too_tight_m2m/,NaN,[removed]
5vtvib,[question] change of HIV when condom too tight (m2m),https://www.reddit.com/r/sex/comments/5vtvib/question_change_of_hiv_when_condom_too_tight_m2m/,throwaway13490150980,1,2017-02-23 15:15:37,1,/r/sex/comments/5vtvib/question_change_of_hiv_when_condom_too_tight_m2m/,NaN,[removed]
5wy8bp,Ex has hiv. I'm negative but now paranoid about having sex again.,https://www.reddit.com/r/sex/comments/5wy8bp/ex_has_hiv_im_negative_but_now_paranoid_about/,[deleted],1,2017-03-01 11:46:10,1,/r/sex/comments/5wy8bp/ex_has_hiv_im_negative_but_now_paranoid_about/,NaN,[removed]
5x8wxd,[anxiety][Possible STD] I had unprotected anal sex 2x and now I'm freaking the fuck out about HIV,https://www.reddit.com/r/sex/comments/5x8wxd/anxietypossible_std_i_had_unprotected_anal_sex_2x/,confused72000,2,2017-03-02 22:43:32,4,/r/sex/comments/5x8wxd/anxietypossible_std_i_had_unprotected_anal_sex_2x/,NaN,"19 year old guy. out of curiosity and because of my insecurities I slept with 2 guys. one was in January and one was in February. Both of them are on prep. didn't use a condom either time. only one guy (1st guy) came in me, the other one did not. 

Am I at a high risk? I read something where the receptive partner has like a 1.34% chance of getting it so if I did it twice does that mean I have a 2.68% chance? Please answer because I'm really worried. I plan on getting tested tomorrow. 

P.S. Yes I realize this wasn't the smartest thing to do and that there are other STDs to worry about but thats not what I'm asking. "
5x9iah,"How is hiv through a condom physically possible, if at all?",https://www.reddit.com/r/sex/comments/5x9iah/how_is_hiv_through_a_condom_physically_possible/,threetimeonly,1,2017-03-03 01:45:40,1,/r/sex/comments/5x9iah/how_is_hiv_through_a_condom_physically_possible/,NaN,[removed]
5xanw8,"[HIV] Is Hiv through an unbroken, properly used condom physically possible, if at all? How?",https://www.reddit.com/r/sex/comments/5xanw8/hiv_is_hiv_through_an_unbroken_properly_used/,threetimeonly,1,2017-03-03 06:38:17,1,/r/sex/comments/5xanw8/hiv_is_hiv_through_an_unbroken_properly_used/,NaN,[removed]
5xnst1,Do I have [HIV]?,https://www.reddit.com/r/sex/comments/5xnst1/do_i_have_hiv/,[deleted],1,2017-03-05 09:10:41,1,/r/sex/comments/5xnst1/do_i_have_hiv/,NaN,[removed]
602ihe,[stds] does taking just one truvada pill right before sex prevent HIV transmission? How or why?,https://www.reddit.com/r/sex/comments/602ihe/stds_does_taking_just_one_truvada_pill_right/,[deleted],1,2017-03-17 21:53:32,3,/r/sex/comments/602ihe/stds_does_taking_just_one_truvada_pill_right/,NaN,[deleted]
62huaf,[RISK] HIV From Kissing?,https://www.reddit.com/r/sex/comments/62huaf/risk_hiv_from_kissing/,[deleted],0,2017-03-30 17:05:13,5,/r/sex/comments/62huaf/risk_hiv_from_kissing/,NaN,[deleted]
640fgy,"Cut on finger, fingered a girl, showing some symptoms. Should I get tested for HIV?",https://www.reddit.com/r/sex/comments/640fgy/cut_on_finger_fingered_a_girl_showing_some/,iamscared44,1,2017-04-07 06:40:27,1,/r/sex/comments/640fgy/cut_on_finger_fingered_a_girl_showing_some/,NaN,[removed]
640lrf,"[STD Risk] Cut on finger, fingered a girl, showing some symptoms. Should I get tested for HIV?",https://www.reddit.com/r/sex/comments/640lrf/std_risk_cut_on_finger_fingered_a_girl_showing/,iamscared44,3,2017-04-07 07:09:54,17,/r/sex/comments/640lrf/std_risk_cut_on_finger_fingered_a_girl_showing/,NaN,"A little less than a week ago I fingered a girl when I had a small cut on my finger. The day after the cut got infected. It swelled up a little, got itchy, and had a little white line running down the middle of it.
Today I woke up with a soar throat and a small rash on my hip. It's about 6, slightly itchy, red splotches in the formation of a Y. They're a little over a quarter inch in diameter and probably 4"" from the top one to the bottom one.   
Pic:   
http://imgur.com/a/SOKE8    
   
I always use a condom so I'm going to be bummed if this is how I get an STD.
"
65i8r9,[HIV] Seriously considering playing with someone who is HIV+ undetectable. Not entirely sure what that entails.,https://www.reddit.com/r/sex/comments/65i8r9/hiv_seriously_considering_playing_with_someone/,SoOutofMyLeague,1,2017-04-15 02:13:45,1,/r/sex/comments/65i8r9/hiv_seriously_considering_playing_with_someone/,NaN,[removed]
65i931,[HIV] I'm (27/m) seriously considering hooking up with someone who's HIV+ undetectable. What should I know?,https://www.reddit.com/r/sex/comments/65i931/hiv_im_27m_seriously_considering_hooking_up_with/,SoOutofMyLeague,1,2017-04-15 02:16:57,1,/r/sex/comments/65i931/hiv_im_27m_seriously_considering_hooking_up_with/,NaN,[removed]
65i9gz,[HIV Undetectable] I (28/m) am seriously considering hooking up with someone who is HIV+ undetectable. What should I know?,https://www.reddit.com/r/sex/comments/65i9gz/hiv_undetectable_i_28m_am_seriously_considering/,SoOutofMyLeague,15,2017-04-15 02:20:58,45,/r/sex/comments/65i9gz/hiv_undetectable_i_28m_am_seriously_considering/,NaN,"I'm getting along great with someone and he's been very open with me about his sexual history and status. He's told me he's been HIV+ undetectable for over 20 years and has never had a problem. I'm seriously considering hooking up with him. One of our kinks is to play with some toys together. We're both male. I thought it'd be hot to share a fleshlight. I'm wondering what risk I'm putting myself at. From most of my research, I've read that it's nearly impossible to transmit HIV if they're undetectable and on meds."
669k5z,"Became a male [prostitute] to pay my grandma's health bills, got HIV. Now how can I continue with sex?",https://www.reddit.com/r/sex/comments/669k5z/became_a_male_prostitute_to_pay_my_grandmas/,thecuriouscaseofme,30,2017-04-19 04:20:37,22,/r/sex/comments/669k5z/became_a_male_prostitute_to_pay_my_grandmas/,NaN,"In short, no parents, grandmom raised me, she got cancer last year, large bills, no money, start selling myself, diagnosed with hiv yesterday. 

I'm 20 M, day job only gives 2400 bucks which is nothing. Renting myself out is the only way my grandmother is getting her treatment, though she still only has few months.

I'm not in shock or sad, so I'm surprised why is that? Also now I don't think I can carry on with these sexual affairs or even with any other person in a relationship when I have this horrible thing. 

Literally, I shortened my life to extend my grandmom's. But it was worth it."
67bl40,What are the odds of me getting STD/HIV or getting woman pregnant when condom slipped off during withdrawal?,https://www.reddit.com/r/sex/comments/67bl40/what_are_the_odds_of_me_getting_stdhiv_or_getting/,blackjack11226,1,2017-04-24 13:06:33,1,/r/sex/comments/67bl40/what_are_the_odds_of_me_getting_stdhiv_or_getting/,NaN,[removed]
67c5fv,Oral warts and HIV,https://www.reddit.com/r/sex/comments/67c5fv/oral_warts_and_hiv/,thugmonk,0,2017-04-24 14:35:06,3,/r/sex/comments/67c5fv/oral_warts_and_hiv/,NaN,[removed]
67eb7m,HIV Risk Analysis - FFM Threesome,https://www.reddit.com/r/sex/comments/67eb7m/hiv_risk_analysis_ffm_threesome/,[deleted],1,2017-04-24 21:14:07,1,/r/sex/comments/67eb7m/hiv_risk_analysis_ffm_threesome/,NaN,[removed]
67eeu2,[Safety] [Casual Sex] HIV Risk Analysis - FFM Threesome,https://www.reddit.com/r/sex/comments/67eeu2/safety_casual_sex_hiv_risk_analysis_ffm_threesome/,Threesomethrowawayqs,2,2017-04-24 21:36:32,5,/r/sex/comments/67eeu2/safety_casual_sex_hiv_risk_analysis_ffm_threesome/,NaN,"Hi everyone,

My GF and I are negative. My GF and I had a threesome with a random girl (lets call her R) from a bar - first time ever. Everything I did with R was covered. R only did kissing (mouth) and touching with my GF. What I am worried about is that after having protected vaginal sex with R, I took off the condom, wiped my penis with a t shirt, and proceeded with unprotected sex with my GF. After the night went by, I remembered and started to worry that when I took off the condom after my time with R, her vaginal discharge was at the base of my penis and condom. I only wiped off the discharge with a shirt and proceeded unprotected with my GF.

So, are we at risk? Or am I overthinking it? Responses I got from an HIV forum board said I am over thinking it and that HIV is fragile; IF R had it, the virus would have been rendered untransmittable because of exposure to air since it is very fragile."
67mymr,I [18M] am scared that I have HIV.,https://www.reddit.com/r/sex/comments/67mymr/i_18m_am_scared_that_i_have_hiv/,[deleted],1,2017-04-26 02:07:47,1,/r/sex/comments/67mymr/i_18m_am_scared_that_i_have_hiv/,NaN,[removed]
67mzzq,I (18M) am scared that I have HIV. [STI SCARE],https://www.reddit.com/r/sex/comments/67mzzq/i_18m_am_scared_that_i_have_hiv_sti_scare/,ilovethereddits,0,2017-04-26 02:18:11,20,/r/sex/comments/67mzzq/i_18m_am_scared_that_i_have_hiv_sti_scare/,NaN,"A girl gave me oral (and I have her oral) 3 days ago without protection. She also grinded on me and I'm scared that my penis got her vaginal fluids on it. I now have a sore throat on one side, swollen glans, light nausea, and a light headache. I have a 99F fever. I'm scared I have HIV or something, is this an accurate concern? Someone I know is sick as well, so it may be that, but I'm just really scared.
"
67r0zj,Girlfriend just tested positive for HIV,https://www.reddit.com/r/sex/comments/67r0zj/girlfriend_just_tested_positive_for_hiv/,Walrus-Boy,1,2017-04-26 14:00:06,1,/r/sex/comments/67r0zj/girlfriend_just_tested_positive_for_hiv/,NaN,[removed]
67rq3f,[STIs] Girlfriends rapid HIV test came back positive,https://www.reddit.com/r/sex/comments/67rq3f/stis_girlfriends_rapid_hiv_test_came_back_positive/,Walrus-Boy,12,2017-04-26 15:56:40,11,/r/sex/comments/67rq3f/stis_girlfriends_rapid_hiv_test_came_back_positive/,NaN,"u/Walrus-Boy
During an appointment to remove her IUD, my girlfriend of 2 mo got a reactive result from a rapid HIV test. The results of the blood draw are still out. She'd never been tested before, and my last rapid test was in Nov of last year (negative). I trusted her, apparently unwisely, and we never used protection. In the last two months we've had sex probably close to sixty times. Can someone help me here? What are the chances of it being a fals e-positive, and if she does have it, what are the odds that I've contacted it as well?"
67vmp7,STD TESTING - Blood test question regarding syphilis HIV,https://www.reddit.com/r/sex/comments/67vmp7/std_testing_blood_test_question_regarding/,asjkhths,1,2017-04-27 06:35:52,1,/r/sex/comments/67vmp7/std_testing_blood_test_question_regarding/,NaN,[removed]
67vr0h,[STI TEST] Blood test Result Question! (HIV test),https://www.reddit.com/r/sex/comments/67vr0h/sti_test_blood_test_result_question_hiv_test/,asjkhths,1,2017-04-27 06:56:18,3,/r/sex/comments/67vr0h/sti_test_blood_test_result_question_hiv_test/,NaN,[removed]
68n78d,[Sexually transmitted infections] Am I at risk of HIV/any STIs?,https://www.reddit.com/r/sex/comments/68n78d/sexually_transmitted_infections_am_i_at_risk_of/,rayj33,1,2017-05-01 10:02:09,5,/r/sex/comments/68n78d/sexually_transmitted_infections_am_i_at_risk_of/,NaN,"Me [F] and an online hook up [F] had sex a few weeks ago. I'm not sure if she's HIV negative, but we didn't do anything super risky (no tribbing, we didn't even do oral, etc.) 

She fingered me, then used a strap on for penetrative sex with me (without a condom, but I know STIs really can't survive on sex toys/out of the body for long at all). She told me the strap on is clean, and we had penetrative sex for a while in different positions using it (doggy/me riding her). 

I know the possibility of getting STIs/HIV simply from a strap on she hadn't used in a while is virtually none. But I'm paranoid that any of her fluids got onto the penetrative end of the strap on and came into contact with mine during penetrative sex or just during the whole thing, even though our genitals never directly touched. Or that if she or any of her previous partners has an STI, there is any possibility of the strap on passing it onto me because it was used before. 

Long story but I can't get tested until September, but I'm not sure if it's even necessary. I'm not too sexually active and it was only really with her. Am I at any risk of any STIs or HIV just from this encounter? It seems to be a super low risk situation but just want to clear things up. "
68r4ja,My friend has never had sex without HIV needles [HIV] [Foreplay],https://www.reddit.com/r/sex/comments/68r4ja/my_friend_has_never_had_sex_without_hiv_needles/,A_concernedcitizen_,0,2017-05-01 21:42:00,5,/r/sex/comments/68r4ja/my_friend_has_never_had_sex_without_hiv_needles/,NaN,[removed]
6aqv52,"Found out I'm HIV- yesterday, but the clinic says they're not allowed to give me a copy of the results or take a picture to show as proof for this guy I'm really interested. Can they really do this?",https://www.reddit.com/r/sex/comments/6aqv52/found_out_im_hiv_yesterday_but_the_clinic_says/,unused-username,1,2017-05-12 05:01:22,1,/r/sex/comments/6aqv52/found_out_im_hiv_yesterday_but_the_clinic_says/,NaN,[removed]
6e8p2f,Hiv is real but its rare ( Among straight people that is),https://www.reddit.com/r/sex/comments/6e8p2f/hiv_is_real_but_its_rare_among_straight_people/,Okino-Woye,1,2017-05-30 10:13:11,1,/r/sex/comments/6e8p2f/hiv_is_real_but_its_rare_among_straight_people/,NaN,[removed]
6f34hg,Fear of HIV is ruining my sex life and my life in general. What are the chances?,https://www.reddit.com/r/sex/comments/6f34hg/fear_of_hiv_is_ruining_my_sex_life_and_my_life_in/,imatacocat,1,2017-06-03 12:50:19,1,/r/sex/comments/6f34hg/fear_of_hiv_is_ruining_my_sex_life_and_my_life_in/,NaN,[removed]
6f36hq,[Health Issues and Sex] I (25/f) have a fear of HIV that is ruining my sex life.,https://www.reddit.com/r/sex/comments/6f36hq/health_issues_and_sex_i_25f_have_a_fear_of_hiv/,imatacocat,1,2017-06-03 13:00:55,1,/r/sex/comments/6f36hq/health_issues_and_sex_i_25f_have_a_fear_of_hiv/,NaN,[removed]
6f38f7,[Heath Issues and Sex] 25/f fear of HIV is ruining my sex life.,https://www.reddit.com/r/sex/comments/6f38f7/heath_issues_and_sex_25f_fear_of_hiv_is_ruining/,[deleted],0,2017-06-03 13:11:14,11,/r/sex/comments/6f38f7/heath_issues_and_sex_25f_fear_of_hiv_is_ruining/,NaN,[deleted]
6gltm2,Worried about hiv,https://www.reddit.com/r/sex/comments/6gltm2/worried_about_hiv/,[deleted],1,2017-06-11 08:05:29,1,/r/sex/comments/6gltm2/worried_about_hiv/,NaN,[removed]
6glxa3,Worried about [hiv],https://www.reddit.com/r/sex/comments/6glxa3/worried_about_hiv/,[deleted],1,2017-06-11 08:25:29,1,/r/sex/comments/6glxa3/worried_about_hiv/,NaN,[removed]
6gn867,Worried potential [hiv infection],https://www.reddit.com/r/sex/comments/6gn867/worried_potential_hiv_infection/,[deleted],1,2017-06-11 12:17:19,8,/r/sex/comments/6gn867/worried_potential_hiv_infection/,NaN,[deleted]
6kjzo5,How long do hiv symptoms take to start after possible infection?,https://www.reddit.com/r/sex/comments/6kjzo5/how_long_do_hiv_symptoms_take_to_start_after/,[deleted],1,2017-06-30 17:36:11,1,/r/sex/comments/6kjzo5/how_long_do_hiv_symptoms_take_to_start_after/,NaN,[removed]
6kk1jh,[hiv] How long do symptoms start after possible infection?,https://www.reddit.com/r/sex/comments/6kk1jh/hiv_how_long_do_symptoms_start_after_possible/,[deleted],1,2017-06-30 17:46:31,1,/r/sex/comments/6kk1jh/hiv_how_long_do_symptoms_start_after_possible/,NaN,[removed]
6ljdtp,Possible HIV infection. Need some help,https://www.reddit.com/r/sex/comments/6ljdtp/possible_hiv_infection_need_some_help/,[deleted],2,2017-07-05 21:13:13,7,/r/sex/comments/6ljdtp/possible_hiv_infection_need_some_help/,NaN,[removed]
6m5cuw,HIV oraquick 58 days after exposure. Tested negative. Should I still be worried?,https://www.reddit.com/r/sex/comments/6m5cuw/hiv_oraquick_58_days_after_exposure_tested/,[deleted],0,2017-07-08 20:32:22,1,/r/sex/comments/6m5cuw/hiv_oraquick_58_days_after_exposure_tested/,NaN,[deleted]
6m7r6d,Possible HIV infection..help,https://www.reddit.com/r/sex/comments/6m7r6d/possible_hiv_infectionhelp/,lelife,0,2017-07-09 07:37:56,8,/r/sex/comments/6m7r6d/possible_hiv_infectionhelp/,NaN,[removed]
6mk8pv,What do I need to know about getting tested for HIV? I need guidance please,https://www.reddit.com/r/sex/comments/6mk8pv/what_do_i_need_to_know_about_getting_tested_for/,[deleted],2,2017-07-10 22:34:44,3,/r/sex/comments/6mk8pv/what_do_i_need_to_know_about_getting_tested_for/,NaN,[removed]
6nl509,Had [sex] without a condom with a woman I had just met off a dating site. Got drunk and made this mistake and now I'm freaking out. Just worried about getting hiv mostly. What can I do?,https://www.reddit.com/r/sex/comments/6nl509/had_sex_without_a_condom_with_a_woman_i_had_just/,oog_ooog,1,2017-07-16 00:59:25,5,/r/sex/comments/6nl509/had_sex_without_a_condom_with_a_woman_i_had_just/,NaN,[removed]
6p4r7h,STD (HIV) Scare. Looking for closure/opinions.,https://www.reddit.com/r/sex/comments/6p4r7h/std_hiv_scare_looking_for_closureopinions/,peaceofmindtemp,2,2017-07-23 16:44:42,2,/r/sex/comments/6p4r7h/std_hiv_scare_looking_for_closureopinions/,NaN,"Hi, so I'm a 20 year old bisexual male and and have been sexually active for a while. Without baring too many unnecessary details I would like to disclose the fact that I made a risky decision in partaking in sexual intercourse with another male, not too long ago.

I had known this guy for a week, through a friend. He is in his 30s, and completely homosexual. We really managed to hit it off when hanging out at my mate's place. Fast forward to a couple days later, we had both exchanged numbers and been talking about hooking up. 

He comes over, and we agreed it was the custom to use condoms, even though he asked if I prefer them or not. He was referring to himself using them, because he knew I wasn't a top, or going to be topping. We had already let eachother know we were clean at this point. No proof. Just word of mouth.

So, we begin having sex and everything is great. Really respectable like I thought, and I generally just felt really comfortable. He then proposes the idea of messing around in the shower for a bit, to which I agree. This is where I feel like I might have made a life changing decision. The previous condom had been taken off before entering the shower, so a new one was not present. 10 minutes of foreplay pass by, and with my back facing him he decides to ask if I'm cool with him inserting himself into me, bare. I agree. I had washed the head of his penis with the running water and immediately guided him in, to which he inserted, and came out immediately. I am very regretful of this. I had always told myself to never let my guard down no matter the circumstance, but I had failed this time.

It has been a couple days since the experience and all I can think about is the fact that it is entirely plausible I could have been exposed to something. Especially considering certain details, like him being just as spontaneous and risk-taking. 

I am ofcourse going to get a screening as soon as possible, but am aware HIV does not show it's signs for an extended time past exposure.. Which raises the question, how fearful/anxious should I be until I have the results? I've already started contemplating living life with the virus, and how big the impact could be. This is ofcourse terrifying, and emotionally draining. I'd also like to possibly hear scenarios of similar instances, and what the outcome was. I know it is illogical to think that the minimal exposure and running water could have meant decreased the chance dramatically, but it is my saving grace thought. My head has been riddled with anxiety, and browser riddled with questions. Is there a measure I could take immediately to help deter the possibility of this life-sentencing virus? I NEED to hear people's opinions on my scenario, and how to go about dealing with it. Possibly even someone that is HIV positive to hear how living life is.

Thankyou all so very much, and I hope I'm able to find some closure. Please excuse my grammar, it is 4 in the morning and I decided to post this just before bed. Thankyou, again."
