bn6xfo,Spent 4 hours driving around creation trying to get a HIV test. Walmart sells the oral ones,https://www.reddit.com/r/sex/comments/bn6xfo/spent_4_hours_driving_around_creation_trying_to/,slimshady178,1,2019-05-10 19:16:01,3,/r/sex/comments/bn6xfo/spent_4_hours_driving_around_creation_trying_to/,NaN,"Two of the free places listed on the get tested website (USA) were completely shut down,and not existing. Although they still take donations on their respective website's. The county health turned me away, saying they will only do it if you already had a positive ""precursor"" test. Finally planned Parenthood will only take walk in's one hour before closing. For a 2 minute thumb prick. Why was this so ridiculously difficult?"
bo8gtz,What are my chances of getting a STD or HIV or HERPES from this prostitute?,https://www.reddit.com/r/sex/comments/bo8gtz/what_are_my_chances_of_getting_a_std_or_hiv_or/,kramtok,1,2019-05-13 13:06:03,7,/r/sex/comments/bo8gtz/what_are_my_chances_of_getting_a_std_or_hiv_or/,NaN,"The last year I've visited a prostitute a few times. This time she suddenly put my dick in her mouth without a condom. I was shocked and immediately pulled my dick out. So it was only in her mouth for maybe less than half a second. I told her I don't wanna risk a STD. She said she normally don't do this without a condom but only do it sometimes with people she know. She also said she don't advertise doing this on the website and that she tested for STD's twice this year and the results came back good with no STD.

&amp;#x200B;

Let's say she have a STD or HIV / HERPES or Genital Warts.. What are the chances I'll get it from this? Like how much % chance?"
bup47f,Question about HIV transmission,https://www.reddit.com/r/sex/comments/bup47f/question_about_hiv_transmission/,beetlethump,1,2019-05-29 21:57:09,2,/r/sex/comments/bup47f/question_about_hiv_transmission/,NaN,"Hi, I just can't figure out how to google this properly to bring up the answer I am looking for. any help will be greatly appreciated.

So, about 6 months ago, I had a boyfriend who was HIV+(he claimed his was undetectable, like the one with the low-to-the-point-of-being-untransmissable kind, and I didnt ask to see doctor papers or anything, but i know he took a pill for it daily). We always had sex with a condom, but one time(the LAST time)ended up doing it without one(under false pretenses on his part, without being too detailed).

I went to a sex clinic thing like 2-3 days afterwards and got tested, and was negative.

So my question is, can it likeee hide and grow then come up positive later? like can you get a false negative if you get tested that soon after the exposure? 

Thank you for any help"
bwc9c0,I can’t have sex because I’m terrified of hiv and Sti’s,https://www.reddit.com/r/sex/comments/bwc9c0/i_cant_have_sex_because_im_terrified_of_hiv_and/,Toby_2104,5,2019-06-03 08:55:17,10,/r/sex/comments/bwc9c0/i_cant_have_sex_because_im_terrified_of_hiv_and/,NaN,I just can’t get it off my mind. I’m so worried about contracting something. At one point I even convinced myself that I gave myself genital herpes (not sure if that’s even possible) by masturbating. I’m worried that as soon as I have sex with someone they’ll have hiv without realizing it and give it to me etc. Any advice? Is hiv common?
bwhh7o,Oral with hiv undetectable?,https://www.reddit.com/r/sex/comments/bwhh7o/oral_with_hiv_undetectable/,a254968,2,2019-06-03 16:14:20,5,/r/sex/comments/bwhh7o/oral_with_hiv_undetectable/,NaN,A while ago I hooked up with someone and we only did oral and I just found out he’s HIV positive but undetectable. I just tested negative but gonna test again in 3 months. Am I at risk?
c18cxs,I might have contracted hiv...,https://www.reddit.com/r/sex/comments/c18cxs/i_might_have_contracted_hiv/,Zijunmomo,3,2019-06-16 03:02:00,27,/r/sex/comments/c18cxs/i_might_have_contracted_hiv/,NaN,"I recently went to japan roughly 3 weeks ago, and had foreplay with a woman, everything was protected, Bj, handjob and sumata. However, i did cunninglus on her, for a good 15 minutes. I dont rmb having any cuts or sores, but if i brush my teeth hard, it would bleed. Anyways, 3 weeks later( The day before my throat infection and fever) i was out with friends and i was drinking lots of coke zero, in the past i had another incident where my throat was uncomfortable after drinking lots of come zero. The next day came and i had a massive fever and sore throat, i saw the doctor and he prescribed me with antibiotics, i just finished my dosage and my fever has went down, but my throat is still painful whenever i swallow something(not as bad as the other days). So, HIV or throat infection? Thanks!"
c1opl3,HIV Medical checkup tomorrow...,https://www.reddit.com/r/sex/comments/c1opl3/hiv_medical_checkup_tomorrow/,Zijunmomo,4,2019-06-17 08:14:39,9,/r/sex/comments/c1opl3/hiv_medical_checkup_tomorrow/,NaN,"Hi, just an update of my previous post. I might have contracted hiv because during my trip to japan 3 weeks ago, i performed oral on an escort, for a good 15 minutes, and last week i had hiv symptoms, which are 1)Fever 2)Sore throat (strep throat to be exact) 3)muscle aches 4)headache 5)diarrhea 6)fatigue. I do not have rashes on my body though... anyways, since i had the symptoms for acute hiv, i was really paranoid and scared because the chances of contracting hiv from oral isnt 0. So i am here to ask anyone if they know 1) anyone who contracted hiv through oral? And 2) are japanese escorts clean?(no hiv) i need to know as i am very scared for tomorrows checkup"
c2a4xj,"Had unprotected gay sex (top) four times in a row, I know the risks of getting stis, but how worried should I be about exposing myself to hiv.",https://www.reddit.com/r/sex/comments/c2a4xj/had_unprotected_gay_sex_top_four_times_in_a_row_i/,earthmonkey82,0,2019-06-18 17:27:55,2,/r/sex/comments/c2a4xj/had_unprotected_gay_sex_top_four_times_in_a_row_i/,NaN,"I know I need to get tested, I will be doing that within the next few days and then again in about three weeks. Should I be stressed or am I likely ok?"
c2p5fc,Does the risk percentages for HIV in sex include ejacuation or no?,https://www.reddit.com/r/sex/comments/c2p5fc/does_the_risk_percentages_for_hiv_in_sex_include/,swissswashcoal,0,2019-06-19 17:39:48,8,/r/sex/comments/c2p5fc/does_the_risk_percentages_for_hiv_in_sex_include/,NaN,Like I read it’s 1 in 1250 to for women to catch it from a partner who is infected but does that include ejacuation?
c2ymi7,Learn about the HIV rate in DC and I am freaking out because I have a guy from DC head,https://www.reddit.com/r/sex/comments/c2ymi7/learn_about_the_hiv_rate_in_dc_and_i_am_freaking/,ringdongyy,1,2019-06-20 10:05:57,0,/r/sex/comments/c2ymi7/learn_about_the_hiv_rate_in_dc_and_i_am_freaking/,NaN,"I am a female btw. I gave this guy fro DC a blow job. He did not ejaculate in my mouth and yes I know HIV transmission is super low but I brushed my teeth before seeing him and I remember having a small wound on my tongue I think fro biting it but I don't remember if this was after the blow job

&amp;#x200B;

But yeah 1/9% of the DC population have HIV that is INSANE and most of them are black which is even scarier!!!! He is a black male living in DC.

&amp;#x200B;

I feel I am at risk. It is too late to take PEP. I am crying rn because now I have to find insurance to take meds"
c4zcl5,Just curious what are the odds of contracting HIV if I a wore a condom,https://www.reddit.com/r/sex/comments/c4zcl5/just_curious_what_are_the_odds_of_contracting_hiv/,drfundip1234,0,2019-06-24 17:48:06,0,/r/sex/comments/c4zcl5/just_curious_what_are_the_odds_of_contracting_hiv/,NaN,[removed]
c55lcz,Terrified of HIV testing,https://www.reddit.com/r/sex/comments/c55lcz/terrified_of_hiv_testing/,beautifulifewk,1,2019-06-25 02:11:46,0,/r/sex/comments/c55lcz/terrified_of_hiv_testing/,NaN,[removed]
c88xho,Is a primary care physician able to order a hiv RNA test for me,https://www.reddit.com/r/sex/comments/c88xho/is_a_primary_care_physician_able_to_order_a_hiv/,rhonda455,1,2019-07-02 05:59:46,8,/r/sex/comments/c88xho/is_a_primary_care_physician_able_to_order_a_hiv/,NaN,"and if so, will it show up on the insurance online because I am under my mom's"
c9cnf2,I’m crying right now because of HIV symptoms,https://www.reddit.com/r/sex/comments/c9cnf2/im_crying_right_now_because_of_hiv_symptoms/,gogodixie,0,2019-07-04 23:29:24,17,/r/sex/comments/c9cnf2/im_crying_right_now_because_of_hiv_symptoms/,NaN,"Everything matches what I have

1. Stiff neck on one side 
2. Minor fever 
2. minor chills
3. Minor sore throat 

This all lasted for about a few days.... started with a stiff neck, then went to chills and minor fever..... once the chills and minor fever went away..... then a minor sore throat came for about a day. 

I’m waiting for the full 30 days before taking the 4th generation test. So I’m taking it on Monday. I should have never listened to him about having sex raw. Even tho I did it once it’s risky. Don’t do the same mistake as me guys. Never let a someone convince you to go raw. I did it once and now it’s my worse mistake"
c9h81y,Never knew that taking the hiv rapid test has a almost 90% accuracy by 29 days,https://www.reddit.com/r/sex/comments/c9h81y/never_knew_that_taking_the_hiv_rapid_test_has_a/,gogodixie,1,2019-07-05 08:26:32,0,/r/sex/comments/c9h81y/never_knew_that_taking_the_hiv_rapid_test_has_a/,NaN,[removed]
cc0v1x,"Here to Help Answer Questions, and Provide FREE condoms and HIV At-Home Test Kits",https://www.reddit.com/r/sex/comments/cc0v1x/here_to_help_answer_questions_and_provide_free/,OhioHIVSTD,1,2019-07-11 13:29:33,0,/r/sex/comments/cc0v1x/here_to_help_answer_questions_and_provide_free/,NaN,"Hello! We're here to answer any questions you all have about sexual health, HIV/AIDS and STIs! If you have any questions at all, please feel free to message us here on reddit, call us at 1-800-332-2437, email us at [ohiohotline@equitashealth](mailto:ohiohotline@arcohio.org).com, or chat with us through [ohiv.org](https://ohiv.org/)!

Also, if you're an Ohio resident, we offer a Free Condom Project through which we can send out free condom packets to Ohio residents monthly!

We have also just begun our FREE At-Home HIV Test Kit program! See if you qualify by going to this linkhttp://ohiv.org/negative-or-unsure/free-hiv-test/"
cc1o48,How accurate is the HIV 4th generation test after 35 days?,https://www.reddit.com/r/sex/comments/cc1o48/how_accurate_is_the_hiv_4th_generation_test_after/,Soundcloudop,1,2019-07-11 14:33:26,0,/r/sex/comments/cc1o48/how_accurate_is_the_hiv_4th_generation_test_after/,NaN,[removed]
cdvl42,How come pornstars don’t get HIV ?,https://www.reddit.com/r/sex/comments/cdvl42/how_come_pornstars_dont_get_hiv/,Badfriendshittygf,0,2019-07-16 04:07:50,10,/r/sex/comments/cdvl42/how_come_pornstars_dont_get_hiv/,NaN,"You see pornstars get tested every 2 weeks. But
HIV has a window period ,which is 3 months or 6 weeks minimum ,where it is highly contagious but people test negative.
The test looks for antibodies. So the antibodies are not formed yet but people can have over 1,000,000  VIRAL LOAD which means extremely high chance of passing it."
cdzu2o,I am in denial that I am HIV negative,https://www.reddit.com/r/sex/comments/cdzu2o/i_am_in_denial_that_i_am_hiv_negative/,milkohfish,2,2019-07-16 10:05:12,17,/r/sex/comments/cdzu2o/i_am_in_denial_that_i_am_hiv_negative/,NaN,"My university offers 4th generation HIV test. I tested negative after 35 days of sexual encounter. However I am in some denial because I did have some cold like symptoms and I have irritation/slight burning sensation in my vagina opening (they say yest infection is common during HIV acute symptoms)

&amp;#x200B;

I feel the woman made a mistake saying it was 4th generation and it was just the regular antibody test that was sent to the lab that takes 3 months to detect it"
ck2ycu,I was raped and I think I got an STI or HIV. I took a test 10 days after my event and today I noticed these please help [nsfw],https://www.reddit.com/r/sex/comments/ck2ycu/i_was_raped_and_i_think_i_got_an_sti_or_hiv_i/,RoughDoubt,5,2019-07-30 20:45:27,12,/r/sex/comments/ck2ycu/i_was_raped_and_i_think_i_got_an_sti_or_hiv_i/,NaN,I was drugged at a party and eventually got taken advantage of by another male. I am not gay and I have no idea how things went down. I am still processing the events. I took an STI test 10 days after the encounter. I haven't gotten the results back. It's been 24 days since the event. Please help I am panicking out and I think my life has been ruined. Could it be HIV? Do I have to take medication for the rest of my life? https://imgur.com/a/PtErYCD
cl13e8,Could I have syphilis or HIV if I have no symptoms and I haven't been sexually active in four years?,https://www.reddit.com/r/sex/comments/cl13e8/could_i_have_syphilis_or_hiv_if_i_have_no/,2191994,3,2019-08-02 00:51:54,12,/r/sex/comments/cl13e8/could_i_have_syphilis_or_hiv_if_i_have_no/,NaN,
cm4bgl,Is it possible to contract HIV or any another STD from a female street worker who performed unprotected oral sex on me?,https://www.reddit.com/r/sex/comments/cm4bgl/is_it_possible_to_contract_hiv_or_any_another_std/,JohnnyU1988,1,2019-08-04 18:11:57,0,/r/sex/comments/cm4bgl/is_it_possible_to_contract_hiv_or_any_another_std/,NaN,[removed]
cogxal,Should I get an STI/HIV. I'm paranoid and worrying.,https://www.reddit.com/r/sex/comments/cogxal/should_i_get_an_stihiv_im_paranoid_and_worrying/,ColdDipp,1,2019-08-10 04:31:21,0,/r/sex/comments/cogxal/should_i_get_an_stihiv_im_paranoid_and_worrying/,NaN,[removed]
cpjjwo,Anybody on pep treatment hiv?,https://www.reddit.com/r/sex/comments/cpjjwo/anybody_on_pep_treatment_hiv/,PEPBOY2019,0,2019-08-12 15:15:06,2,/r/sex/comments/cpjjwo/anybody_on_pep_treatment_hiv/,NaN,Just wanted to know if anybody out there's ever been on pep for hiv exposure? Could use some advice I been dealing with a lot of side effects that's not getting better. and my nurse thinks I'm fine. really need someone to talk to my hiv test is in 3weeks . I'm 23 male I topped a guy protected. took off condom and had unprotected oral. I finished in his mouth he is positive for hiv I don't think he on treatment I did Miss a dose of pep my nurse said that was fine.. bitting my fingers can't stop thinking about this. I'm so nervous just give me some advice plz . No jerks
cppehb,Chances of contracting HIV from heterosexual sex using a condom?,https://www.reddit.com/r/sex/comments/cppehb/chances_of_contracting_hiv_from_heterosexual_sex/,DoucheBaggins12,2,2019-08-12 23:53:16,13,/r/sex/comments/cppehb/chances_of_contracting_hiv_from_heterosexual_sex/,NaN,"I hired an escort and got a blowjob with a condom on. After the blowjob, we had sex with the condom still on. I felt really weird about being with an escort (not knocking escorts, I just felt weird) and called it off after maybe a couple of minutes (most expensive couple of minutes of my life lol). 

I've been paranoid about getting an std since then, even though I asked the lady if she was clean and she said 100% that she was.

I even checked to make sure the condom wasnt broken after she left and it wasnt. 

Am I just being paranoid? I've heard that escorts actually have a lower incident of std's than most people, and the fact that she automatically put a condom on me makes me feel better since that sort of implies that she practices safe sex on the regular."
cqh50q,Side effects and stress or symptoms of hiv?,https://www.reddit.com/r/sex/comments/cqh50q/side_effects_and_stress_or_symptoms_of_hiv/,PEPBOY2019,1,2019-08-14 15:39:07,0,/r/sex/comments/cqh50q/side_effects_and_stress_or_symptoms_of_hiv/,NaN,[removed]
cqwjxf,Std and hiv,https://www.reddit.com/r/sex/comments/cqwjxf/std_and_hiv/,PEPBOY2019,1,2019-08-15 14:46:15,0,/r/sex/comments/cqwjxf/std_and_hiv/,NaN,"I am sitting here shaking in my pants . I had unprotected oral sex buy some guy how claims to hiv positive not on treatment. Wtf . I also topped him had protected anal sex . I'm on pep day 14 missed one dose early on but the nurse said I was okay just don't miss anymore . Worried about the oral part. Test results come back tommorow. If neg testing in two more weeks , then two months . I'm so nervous I don't know what to do"
cs78gf,Hiv risk?,https://www.reddit.com/r/sex/comments/cs78gf/hiv_risk/,awayt84,1,2019-08-18 14:17:04,0,/r/sex/comments/cs78gf/hiv_risk/,NaN,[removed]
cssyxc,Chances of HIV?,https://www.reddit.com/r/sex/comments/cssyxc/chances_of_hiv/,ThrowAway10196102,1,2019-08-19 22:11:53,8,/r/sex/comments/cssyxc/chances_of_hiv/,NaN,"Hey, throwaway for obvious reasons. I'm pretty sure I am okay but im am just looking for a bit of peace of mind. I recently got out of a relationship, and decided I wanted to just hook up. I matched with a girl on tinder and within a couple of weeks, I found myself at her place. We had protected vaginal sex, but unprotected oral sex. I ate her out and she gave me a blowjob. She said she was clean, and got tested two weeks ago. But she also has had sex with two other guys within the past month, so if she caught something, the STD test might not have picked it up. She had a tongue piercing, that she said she got back in march. I had a canker sore that recently healed a few days prior. Im sure i am just being paranoid but I have had so much anxiety since the hook up. I know the likilihood of HIV is low, but i am still unsure based off the whole canker sore and tongue piercing, since blood could leak through the piercing or vaginal fluid can have gotten in the canker sore. I went to planned parenthood two days after to take and tested negative for HIV and am waiting on the results for the other STDS. I plan on going back 4 weeks after to take another test to be sure and will probably have anxiety until then. I'm just looking to strangers on reddit to help ease my anxiety."
cup99k,What are the chances of getting HIV from giving oral to a women?,https://www.reddit.com/r/sex/comments/cup99k/what_are_the_chances_of_getting_hiv_from_giving/,ltedmosbyl6,1,2019-08-23 22:03:50,0,/r/sex/comments/cup99k/what_are_the_chances_of_getting_hiv_from_giving/,NaN,[removed]
cv4gus,Chances I've contracted HIV?,https://www.reddit.com/r/sex/comments/cv4gus/chances_ive_contracted_hiv/,bobripscones,1,2019-08-24 22:07:18,0,/r/sex/comments/cv4gus/chances_ive_contracted_hiv/,NaN,[removed]
cw8827,How to stop being scared I’ll contract HIV?,https://www.reddit.com/r/sex/comments/cw8827/how_to_stop_being_scared_ill_contract_hiv/,ScaredddThrowawayyy,1,2019-08-27 11:11:53,0,/r/sex/comments/cw8827/how_to_stop_being_scared_ill_contract_hiv/,NaN,[removed]
d0ao9c,Could I have HIV?,https://www.reddit.com/r/sex/comments/d0ao9c/could_i_have_hiv/,redtomato6,2,2019-09-05 19:35:44,6,/r/sex/comments/d0ao9c/could_i_have_hiv/,NaN,"Female 22 - Hi, I am a generally health 22yo woman who in the last few months has had weird symptoms. I got molluscum on my inner thighs a few months ago, had it treated and did not come back but within the last month or so developed fungal acne on my back, have a yeast infection and have flu-like symptoms - I’m exhausted, low energy, dry cough and achy.

I have only been with one partner the last year, one before that. These symptoms seem like they would be acute based on what I am reading but there is no way my partner has cheated on me. Is it possible for acute symptoms to be delayed one year+? 

Really freaking out."
d0qpbj,STD and HIV paranoia anxiety,https://www.reddit.com/r/sex/comments/d0qpbj/std_and_hiv_paranoia_anxiety/,devito69,1,2019-09-06 19:55:55,0,/r/sex/comments/d0qpbj/std_and_hiv_paranoia_anxiety/,NaN,[removed]
d22c4p,Anxious about HIV test result?,https://www.reddit.com/r/sex/comments/d22c4p/anxious_about_hiv_test_result/,curiouskat21,1,2019-09-09 20:57:33,0,/r/sex/comments/d22c4p/anxious_about_hiv_test_result/,NaN,"Hello everyone! 21 (F) and I'm having a bit of a dilemma. Few weeks back I had an unexpected sexual encounter with a guy. Probably around 5-7 minutes max which included unprotected PIV and oral (30 secs-1 minute) Yes we stopped and didn't finish since we barely just started.

Couple of days later I felt tired and a bit fatigued. Then I started to worry if I contracted any std.

12 Days after exposure: HIV 4th Gen. Test
20 Days after exposure: HIV RNA Early Detection Test
21 Days after exposure: HIV 4th Gen. Test + STD Panel (Chlamydia, Gonnorhea, and Syphilis)

I've received all of the results and they were negative. I'm just worried because I have a bit of a low grade fever that's not going away? And a bit of back pain every now and then. I went to the the doctor two weeks after the exposure and they found out my urine was high in leukocytes indicating an infection. He said it was UTI but after telling him about the encounter he said there was a small possibility of STD but unlikely HIV. After taking the UTI meds the back pain did subsided. 

Should I still worry? I'm still planning to get the test done at 45 and 90 days. Granted the stress/anxiety could have weakened my immune system, but any thoughts?"
d26if6,Please help hiv,https://www.reddit.com/r/sex/comments/d26if6/please_help_hiv/,Hivscare2019,1,2019-09-10 04:58:02,7,/r/sex/comments/d26if6/please_help_hiv/,NaN,"Received a blow job from another male l
I am very nervous about hiv and I know I should not have done it. Can I really get hiv like this?"
d4dxoj,HIV risk?,https://www.reddit.com/r/sex/comments/d4dxoj/hiv_risk/,cclayton58,1,2019-09-14 18:12:30,0,/r/sex/comments/d4dxoj/hiv_risk/,NaN,[removed]
d5g2sm,I’m scared I have HIV,https://www.reddit.com/r/sex/comments/d5g2sm/im_scared_i_have_hiv/,digitalkids,1,2019-09-17 05:12:05,0,/r/sex/comments/d5g2sm/im_scared_i_have_hiv/,NaN,[removed]
d6vwe4,Aids/HIV,https://www.reddit.com/r/sex/comments/d6vwe4/aidshiv/,kingkingking2005,1,2019-09-20 07:42:40,1,/r/sex/comments/d6vwe4/aidshiv/,NaN,How does HIV spread? Do you need to have it in your system even before its contagious to somebody else or what? I not educated on it?
d9bu8n,Chance of getting HIV?,https://www.reddit.com/r/sex/comments/d9bu8n/chance_of_getting_hiv/,quannee,1,2019-09-25 17:12:29,14,/r/sex/comments/d9bu8n/chance_of_getting_hiv/,NaN,"So stressed out right now. I had sex with a sex worker, condom on, in the middle there was some blood and looks like she was on her (early) period, but we continued a short while. Then I removed the condom and she performed a handjob, likely with hands that touched the blood earlier.

No symptom yet (only 4 days ago), but feel like could be freaking out over anything like a mild headache or fever.

Is this high risk to contract HIV? Especially on the period &amp; hand that touched the blood parts. Didn't know about her status.

Thanks!"
d9eri7,HIV anxiety is killing me,https://www.reddit.com/r/sex/comments/d9eri7/hiv_anxiety_is_killing_me/,BillyBurrow,1,2019-09-25 21:34:12,0,/r/sex/comments/d9eri7/hiv_anxiety_is_killing_me/,NaN,[removed]
dbakr8,I had sex last night and now i got the flu. Possible HIV?,https://www.reddit.com/r/sex/comments/dbakr8/i_had_sex_last_night_and_now_i_got_the_flu/,alanxito1998,0,2019-09-30 05:07:58,18,/r/sex/comments/dbakr8/i_had_sex_last_night_and_now_i_got_the_flu/,NaN,Hello i had protected vaginal intercourse last night with a girl i met at a party but also unprotected oral sex. Now i feel very sick like i got the flu. Possible HIV?
ddz2ib,Had drunk sex with a random girl who was on her period. Should I get HIV post-exposure?,https://www.reddit.com/r/sex/comments/ddz2ib/had_drunk_sex_with_a_random_girl_who_was_on_her/,fifawanker,5,2019-10-05 22:25:13,10,/r/sex/comments/ddz2ib/had_drunk_sex_with_a_random_girl_who_was_on_her/,NaN,Made a stupid mistake last night and had drunken sex with a random girl I don't know. I didn't ejaculate and I used a condom but I was so wasted that I can't be 100% sure that I put it on properly. I definitely remember feeling the condom being on. The actual sex only lasted like 30 seconds because I was too drunk and I went soft. The girl was also on her period. Now i am freaking out about HIV. Should I get the post-exposure treatment?
denzkp,Is it possible to get HIV from a blowjob?,https://www.reddit.com/r/sex/comments/denzkp/is_it_possible_to_get_hiv_from_a_blowjob/,srt8_JJ,1,2019-10-07 12:01:51,0,/r/sex/comments/denzkp/is_it_possible_to_get_hiv_from_a_blowjob/,NaN,"On sept 25 i got a bj from a girl i used to date.... im like 99.9% sure shes clean but my bad anxiety gets the best of me.... so i keep thinking dumb stuff.... i just meed peace of mind... and  Im asking as well because every time i search google it leads me to other results . Not specifically that question and answer.. 
thanks in advance fam!... 😞"
deoovh,Can you get HIV from a blowjob??,https://www.reddit.com/r/sex/comments/deoovh/can_you_get_hiv_from_a_blowjob/,srt8_JJ,1,2019-10-07 12:51:02,0,/r/sex/comments/deoovh/can_you_get_hiv_from_a_blowjob/,NaN,"Hello fam,

Im a male... On sept 25 i got a blowjob from a girl i used to date... im like 99.9 % sure shes clean. Yet my bad anxiety doesnt live my life. So i keep thinking the “what if” . 
Also everytime i google something it leads me to a question asked 
So that is my question. Thanks in advance.."
dgr5qf,Partner who is HIV positive,https://www.reddit.com/r/sex/comments/dgr5qf/partner_who_is_hiv_positive/,candyfromstatefarm,1,2019-10-11 22:52:58,6,/r/sex/comments/dgr5qf/partner_who_is_hiv_positive/,NaN,"Any tips on practicing safe sex with a partner who is HIV positive?
My partner is male and on medications. I'm going on PrEP soon, and I would like to know more about what I can do make sure we're both safe."
