axnm7z,"H.I.V. Is Reported Cured in a Second Patient, a Milestone in the Global AIDS Epidemic",https://www.nytimes.com/2019/03/04/health/aids-cure-london-patient.html,Music908,23,2019-03-05 09:20:12,4,/r/gaybros/comments/axnm7z/hiv_is_reported_cured_in_a_second_patient_a/,NaN,
b0zzj4,The Florence Nightingale of AIDS patients,https://en.wikipedia.org/wiki/Brownie_Mary,Fiyero109,2,2019-03-14 05:53:40,0,/r/gaybros/comments/b0zzj4/the_florence_nightingale_of_aids_patients/,NaN,
b3t7rg,The NYT did a really interesting episode of the Daily about the history of looking for a cure for HIV/AIDS,https://itunes.apple.com/us/podcast/the-daily/id1200361736?mt=2#episodeGuid=gid%3A%2F%2Fart19-episode-locator%2FV0%2FIPCOpOhjPGk7iXQPbLj7UYPwS9BMCsAXve1Vx6EJsF0,emilydickinsonsgf,13,2019-03-21 10:18:15,1,/r/gaybros/comments/b3t7rg/the_nyt_did_a_really_interesting_episode_of_the/,NaN,
b67980,"Bohemian Rhapsody's Chinese cut: no homosexuality, no frocks – and no Aids | Film",https://www.theguardian.com/film/2019/mar/27/bohemian-rhapsody-chinese-cut-no-homosexuality-no-frocks-no-aids,QueerCockLuck,26,2019-03-27 10:44:47,7,/r/gaybros/comments/b67980/bohemian_rhapsodys_chinese_cut_no_homosexuality/,Politics/News,
be80uo,"Bros, I'm raising money for [AIDS/LifeCycle](www.tofighthiv.org/goto/karlj). Please make a donation, every little bit helps provide lifesaving and preventative care to the LGBT community. Thanks so much!",https://i.redd.it/l3hetezswts21.jpg,KarlSomething,1,2019-04-17 06:49:01,0,/r/gaybros/comments/be80uo/bros_im_raising_money_for/,NaN,
be81qd,"Bros, I'm raising money for [AIDS/LifeCycle](http://www.tofighthiv.org/goto/karlj) . Please make a donation, every little bit helps provide lifesaving and preventative care to the LGBT community. Thanks so much!",https://i.redd.it/9be6bvwbxts21.jpg,KarlSomething,1,2019-04-17 06:51:22,0,/r/gaybros/comments/be81qd/bros_im_raising_money_for/,Sports/Fitness,
be85ya,"Bros, I'm raising money for AIDS/LifeCycle. Even a small donation helps to provide preventative and lifesaving care to the LGBT Community. I hope you will consider donating and thank you all so much!",http://www.tofighthiv.org/goto/karlj,KarlSomething,2,2019-04-17 07:02:28,0,/r/gaybros/comments/be85ya/bros_im_raising_money_for_aidslifecycle_even_a/,NaN,
be8haz,AIDS/LifeCycle,https://www.reddit.com/r/gaybros/comments/be8haz/aidslifecycle/,KarlSomething,0,2019-04-17 07:30:54,1,/r/gaybros/comments/be8haz/aidslifecycle/,NaN,"Bros, I'm raising money for [AIDS/LifeCycle](https://www.tofighthiv.org/goto/karlj) to help provide lifesaving and preventative care to the LGBT community. Every little bit helps, so please consider making a donation to support my 545 mi. bike ride from San Francisco to Los Angeles in just over a month. You bros rock!

![img](6kbke6r14us21)"
bk9g8i,"AIDS drugs prevent sexual transmission of HIV in gay men, study finds",https://www.reddit.com/r/gaybros/comments/bk9g8i/aids_drugs_prevent_sexual_transmission_of_hiv_in/,ChocolateTsar,29,2019-05-03 08:00:47,2,/r/gaybros/comments/bk9g8i/aids_drugs_prevent_sexual_transmission_of_hiv_in/,Health/Body,"&gt;A European **study of nearly 1,000 gay male couples who had sex without condoms — where one partner had HIV and was taking antiretroviral drugs to suppress it — has found the treatment can prevent sexual transmission of the virus.**  
&gt;  
&gt;**After eight years of follow-up of the so-called serodifferent couples, the study found no cases at all of HIV transmission within couples.**  
&gt;  
&gt;**The study proves, the researchers said, that using antiretroviral therapy to suppress the AIDS virus to undetectable levels also means it cannot be passed on via sex, the researchers said.**  
&gt;  
&gt;**""Our findings provide conclusive evidence for gay men that the risk of HIV transmission with suppressive ART is zero,"" said Alison Rodger, a professor at University College London who co-led the research.**  
&gt;  
&gt;...  
&gt;  
&gt;The study, published in the Lancet medical journal on Thursday, assessed the risk of HIV transmission between serodifferent gay male couples - where one partner is HIV-positive and one is HIV-negative - who do not use condoms.  
&gt;  
&gt;Its findings add to an earlier phase of the study which looked at HIV transmission risk for serodifferent heterosexual couples in the same circumstances. It also found zero risk.  
&gt;  
&gt;**While 15 of the men among the 972 gay couples in this phase did become infected with HIV during the eight years of follow-up, genetic testing showed their infections were with strains of HIV acquired from another sexual partner.**  
&gt;  
&gt;**Since the start of the AIDS epidemic in the 1980s, more than 77 million people have become infected with HIV. Almost half of them - 35.4 million - have died of AIDS.**

\[NBC News\]

&amp;#x200B;

For those with a background in science or curiosity to read the research click &gt;&gt; [Lancet](https://www.thelancet.com/journals/lancet/article/PIIS0140-6736(19)30418-0/fulltext#seccestitle130).

&amp;#x200B;

Note from OP: Taking Truvada only stops the spread of HIV, it will not protect you from STDs gents. Be safe."
bnqbxy,Need your help fundraising for the AIDS Lifecycle ride. A 545 mile ride from SF to LA. Your donations really do help those who are struggling with access to health care and services. Thank you gaybros!,http://www.tofighthiv.org/goto/aaron-raines,Ayayrun,0,2019-05-12 08:44:40,0,/r/gaybros/comments/bnqbxy/need_your_help_fundraising_for_the_aids_lifecycle/,NaN,
bpt4dk,disgusting people like this are the reason why hiv and aids will never me eliminated,https://i.redd.it/hoc0srjoosy21.jpg,babybop224,0,2019-05-17 09:04:20,6,/r/gaybros/comments/bpt4dk/disgusting_people_like_this_are_the_reason_why/,Misc,
cbe8gp,"H.I.V. Is Reported Cured in a Second Patient, a Milestone in the Global AIDS Epidemic",https://www.nytimes.com/2019/03/04/health/aids-cure-london-patient.html,lipstickv,319,2019-07-10 01:48:17,19,/r/gaybros/comments/cbe8gp/hiv_is_reported_cured_in_a_second_patient_a/,NaN,
d38j2z,"Gay 'chemsex' is fuelling urban HIV epidemics, AIDS experts warn",https://www.reuters.com/article/us-health-aids-chemsex-idUSKCN1VX1HF,SetMau92,17,2019-09-12 07:15:56,9,/r/gaybros/comments/d38j2z/gay_chemsex_is_fuelling_urban_hiv_epidemics_aids/,Health/Body,
d4h2v3,"Gareth Thomas, Ex professional rugby player travels he has Aids! Another boundary pushed by the ex wales captain! I doth my hat to you squire!",https://i.redd.it/k8ctpdmnfpm31.jpg,gingeadventures,0,2019-09-14 23:47:41,4,/r/gaybros/comments/d4h2v3/gareth_thomas_ex_professional_rugby_player/,NaN,
dsh0uz,Gay Pulp fiction from the pre-aids/pre-vcr era. Endless titillation for gaybros of those days.,https://i.redd.it/2ns9pks1t2x31.png,vmcla,1906,2019-11-06 06:27:12,73,/r/gaybros/comments/dsh0uz/gay_pulp_fiction_from_the_preaidsprevcr_era/,NaN,
e4k972,Today is World AIDS Day and lets take time to remember the gay bros we lost today and to those who survived and continue to survive a plague. As a young gay man I have no idea how hard it must’ve been. I want to continue to learn as much as I can and respect our gay elders.,https://i.redd.it/4wcuvnc222241.jpg,joshgrad444,1,2019-12-01 09:16:37,20,/r/gaybros/comments/e4k972/today_is_world_aids_day_and_lets_take_time_to/,NaN,
e4u0m5,You are missed. (World Aids Day),https://www.reddit.com/r/gaybros/comments/e4u0m5/you_are_missed_world_aids_day/,tommygunz007,1,2019-12-01 21:00:53,15,/r/gaybros/comments/e4u0m5/you_are_missed_world_aids_day/,NaN,"I lost George, Roc, Fred, and there were thousands of others who died then. Tonight I remember you. I cry for you. I remember the good times we had, the laughter, the fun, and how much you wanted to be loved by the world around you, by your friends, and mostly by your parents. I remember what it was like at the end, when you could only see out of one eye, and your body was covered in spots. I remember when you walked into the bar on crutches and you were dead by 22. F*** you looked terrible and you caught it at 17. When I heard that Roc passed, I dropped to the floor of that nightclub in tears. 

There were so many who died. So many. So young, so young. I remember every week 'did you hear ____ died?' It was like a revolving door of death every week. Madonna's 'Take a Bow' played every Saturday night, as the dance floor was filled with tears. I was the lucky one, the late bloomer, the one who used protection.

It's been 25 years since I saw you my friends. 25 years since I laughed with you, saw you at the club, saw you enjoying life. It's been 25 long years since you died. 

Tonight you are in my heart, and in my memory. 

I hope you are someplace better, someplace happy. Please know that I was your friend, and always will be. Tonight, on this day, I miss you. 

Had you been a few years older, you would still be alive today, chatting with me on the phone instead of me sitting here honoring your memory.

On Aids day, please remember those friends we lost, those family we lost, and how important life truly is. 

I miss you my friends. I hope you are in a better place.

RIP."
e9s8xf,I convinced myself for years that AIDS didn’t shape me. I was wrong.,https://www.inquirer.com/opinion/commentary/aids-gay-sexuality-lgbt-trauma-20191212.html,milleribsen,1,2019-12-12 11:25:45,3,/r/gaybros/comments/e9s8xf/i_convinced_myself_for_years_that_aids_didnt/,NaN,
eb2tnh,"Our Cultural History, v.3 — Surviving Stigma | Tom Bianchi [The HIV/AIDS Crisis Era + How Many R/Bros Lived This Time Period?]",https://youtu.be/wNrySox8hn4,TDRMC,1,2019-12-15 10:50:04,2,/r/gaybros/comments/eb2tnh/our_cultural_history_v3_surviving_stigma_tom/,Misc,
eifs05,Only one name was added to Toronto’s AIDS memorial in 2019. Up to seven plaques were required in some years to list all the Bros who were being claimed by the epidemic. One name.,https://i.redd.it/9zs2mjueg4841.jpg,vmcla,1,2019-12-31 23:45:25,152,/r/gaybros/comments/eifs05/only_one_name_was_added_to_torontos_aids_memorial/,NaN,
ekkqy1,UPDATE on the Toronto AIDS memorial where only ONE NAME was added for 2019. I went back there today and noticed that Chad Walton’s plaque had been festooned. Made my day. Link to original post in comments.,https://i.redd.it/hyi91lbol1941.jpg,vmcla,1,2020-01-05 15:13:42,5,/r/gaybros/comments/ekkqy1/update_on_the_toronto_aids_memorial_where_only/,NaN,
es7qm0,Much Of What’s Left Of The AIDS Generation— And Much Of What’s Left Of Me,https://www.reddit.com/r/gaybros/comments/es7qm0/much_of_whats_left_of_the_aids_generation_and/,silverlakebob,1,2020-01-21 21:54:25,37,/r/gaybros/comments/es7qm0/much_of_whats_left_of_the_aids_generation_and/,NaN,"By the AIDS generation I mean *my* generation. That is, those of us lucky enough to have emerged from the ‘80s and ‘90s with our bodies still intact (for a great many, just barely) but our souls more than ravaged. Did anyone hear the funny little quip making the rounds after the cocktail came out in 1996? “The good news is that I’m not dying. And the *bad news* is that I’m not dying.” Why, one might wonder, would anyone say such a thing? One unmistakable feature of the plague years was the decision of a large number of HIV+ men to drop out of the workforce, to quit their jobs, to get on disability, and to try to enjoy what little time they had left. There seemed little point to put in the work and invest the energy to advance one’s career with typical delayed-gratification maturity, because everyone knew that our promising careers (and everything else in our lives) would soon to be over. There seemed little point to plan for the future, as any normal adult naturally would. There seemed little point to save money or prudently invest for a better day, because that day was surely never coming. There seemed little point to think of anything but the present moment, which in any case was riddled with constant caregiving of those just a little worse off with that miserable malady of ours, and sullied by our chronic fear of what’s to come. So it was not at all uncommon to see guys run up their credit cards as if there was no tomorrow (oh wait, there *wasn’t*) and to live it up until they dropped.

But then came the rude awakening, the *wonderful* news, that we’re not all going to die after all. When they quite suddenly got a new lease on life, so many guys found themselves living on meager disability payments barely covering everyday expenses (and precious little else), residing in Section 8 apartments they could hardly stand, and pretty much unemployable given the many years they had been out of the workforce or had not worked at all. My friend Kim, well over 40 by that time, simply couldn’t bring himself to work in an entry-level position with nineteen and twenty year-olds and kept hoping he could pull off a miracle and land a higher-ranking job just as he had before— a miracle that never came. So he did nothing. I’ve met quite a few guys like Kim in HIV support groups I’ve attended: not working, horribly impoverished, barely making enough to keep themselves afloat in today’s unaffordable urban scene, suffering from physical ailments caused by prolonged side-effects of the HIV drugs, wanting to start anew but convinced that it’s far too late to even try, tired and hopeless and lacking ambition for something *(anything)* to brighten up their lives. Welcome to a large proportion of long-term survivors of the AIDS years. Welcome to a large proportion of what’s left of my generation. Welcome to the despondent “heroes” we all celebrate in theory but ignore in practice.

As for me, I didn’t fall into debt and for some reason didn’t completely give up on my future. I went to school and got a Ph.D during that frightful time. But I was still adversely affected by the fatalism. I wanted to write a book on something that enthralled me, and I focused almost exclusively on that instead of my future career. I never strategized with my professors on how to best land a job because I assumed that I probably wouldn’t be needing one. I just wanted to write that book before I croaked, and, to my ever-lasting joy, I was able to do it. So once I graduated I didn’t get a great academic job that I perhaps could have gotten had I been more strategic and spent more time networking, but I was (and am) in a much better position career-wise and financially than are so many HIV+ guys of my generation.

Likewise, the fatalism quite assuredly affected me in my personal life. I put up (and then some) with an abusive, sociopathic boyfriend because I fatalistically thought that no one else would have me. (Who in their right mind, I thought, would in the mid-1990s take on another relationship with an HIV+ person after having watched so many die??) I gladly gave him more and more money because, let’s be honest, *I* wasn’t going to need it. (I didn’t fully realize that I was a slow-progressor and genetically more resistant to the virus until the very end of the 1990s.) So, even though I’m far more fortunate than are so many guys who are stuck in horrible poverty and bored with their lives, I’m still right there with them with my own adverse effects of having lived through the plague years. My soul is just as ravaged as theirs.

But not for much longer! I’ve had it up to here with wasting my time and energy on past regret and I’m eager to celebrate my being alive! This year, I’m happy to tell you, is going to be *a wild ride* as I embark on a sexual/romantic comeback that will put the poets to shame— a comeback ever so enhanced by my renewed muscular, slim body. I now weigh, I’m proud to report, under 180 lbs. for the first time in twenty-five years, only a few pounds away from my long-term goal of 175— and that’s with all those newly shaped, weighty muscles [I’ve been working so hard to get this past year](https://www.reddit.com/r/AskGaybrosOver30/comments/dlry8m/its_been_a_full_year_since_i_started_working_out/).

But I need some company! I encourage all of my long-term survivor bros (and everyone else out there) to decide not to wait another day, to start working on shedding those pounds and getting back into shape, to come on board and join me on that wild ride, and to never, *never* give up. Because after all we’ve gone through, it’s just not allowed."
exp2qw,"Gay history: Liz Taylor was the first celebrity to fight for an aids related charity, and a staunch supporter of gay rights supporting her friend Rock Hudson. Please don’t forget how important she is",https://i.redd.it/y8tklu6csie41.jpg,deepthroatcircus,1,2020-02-02 06:22:00,0,/r/gaybros/comments/exp2qw/gay_history_liz_taylor_was_the_first_celebrity_to/,NaN,
f3upu0,Has anybody seen/read HOLDING THE MAN? It’s an autobiography that tells the story of two Australian teens who fall in love in the 1970s. It’s one of my most beautifully written books made even more special in that the author died of AIDS just ten days after he finished the book.,https://i.redd.it/9aob2i8d3xg41.jpg,IsMisePrinceton,1,2020-02-14 08:37:03,51,/r/gaybros/comments/f3upu0/has_anybody_seenread_holding_the_man_its_an/,NaN,
fqbr6q,"Mark S. King: ""No one cared about people dying of AIDS in the early years of the pandemic"" Stop Comparing Coronavirus To Early HIV/AIDS. Just Stop.",https://i.redd.it/dg0kaawotbp41.jpg,Hunter-Bywatt,1,2020-03-27 19:42:35,15,/r/gaybros/comments/fqbr6q/mark_s_king_no_one_cared_about_people_dying_of/,NaN,
fu1ozy,Dr. Fauci Discussing the Latest Research on the HIV/AIDS Virus in 1984,https://youtu.be/pzK3dg59TuY,Kac985,1,2020-04-02 21:28:50,5,/r/gaybros/comments/fu1ozy/dr_fauci_discussing_the_latest_research_on_the/,NaN,
gkfodk,Guyyss The 1992 Freddie Mercury tribute concert is live on YT for the next 48hrs and I am dyinnggg 💞 Check it out! In honour of Aids Awareness Week,https://youtu.be/PN7oGo6qlMA,Wallyboy95,1,2020-05-15 12:24:33,0,/r/gaybros/comments/gkfodk/guyyss_the_1992_freddie_mercury_tribute_concert/,NaN,
grn4hf,"Larry Kramer, Playwright and Outspoken AIDS Activist, Dies at 84",https://www.nytimes.com/2020/05/27/us/larry-kramer-dead.html?referringSource=articleShare,lysdexic__,1,2020-05-27 09:39:06,35,/r/gaybros/comments/grn4hf/larry_kramer_playwright_and_outspoken_aids/,NaN,
grp6t1,"Faggots, The Normal Heart is gone: Larry Kramer, Playwright and Outspoken AIDS Activist, Dies at 84",https://www.nytimes.com/2020/05/27/us/larry-kramer-dead.html,ColdWarConcrete,1,2020-05-27 11:21:56,1,/r/gaybros/comments/grp6t1/faggots_the_normal_heart_is_gone_larry_kramer/,NaN,
gsxn2f,"I’m annoyed people are comparing Stonewall to the Minneapolis Riots. We never destroyed businesses, looted, or fought with other civilians. During AIDS we made quilts, we didn’t destroy our cities",https://www.reddit.com/r/gaybros/comments/gsxn2f/im_annoyed_people_are_comparing_stonewall_to_the/,JesperGustafsson,1,2020-05-29 10:49:17,2,/r/gaybros/comments/gsxn2f/im_annoyed_people_are_comparing_stonewall_to_the/,NaN,[removed]
hg1swm,The Face of AIDS - Life Magazine 1990,https://www.reddit.com/r/gaybros/comments/hg1swm/the_face_of_aids_life_magazine_1990/,ChocolateTsar,1,2020-06-25 22:32:11,2,/r/gaybros/comments/hg1swm/the_face_of_aids_life_magazine_1990/,NaN,"&amp;#x200B;

[The Face of AIDS, Life Magazine 1990 \(Therese Frare\)](https://preview.redd.it/s105l2zcx6751.jpg?width=1600&amp;format=pjpg&amp;auto=webp&amp;s=919a28a9012342779715b11e137360f068ac34ae)"
hhqn67,"Guy Clark of San Francisco isn't your typical florist. He has been selling flowers over 35 years on the same street corner - 15th &amp; Noe. During the AIDs epidemic, he made floral arrangements (some for free) for many of the gay men who lost friends or loved ones to AIDs.",https://i.redd.it/d47xzqcd2r751.jpg,ChocolateTsar,26,2020-06-28 18:23:42,5,/r/gaybros/comments/hhqn67/guy_clark_of_san_francisco_isnt_your_typical/,NaN,
hmhe10,"There was a gay dance party in Fire Island this weekend, no masks. AIDS Activist Cleve Jones is not having it.",https://i.redd.it/qw5tfoe16b951.jpg,stripchat_official,196,2020-07-06 14:52:50,41,/r/gaybros/comments/hmhe10/there_was_a_gay_dance_party_in_fire_island_this/,NaN,
idk6vc,Hey could yall tell more stories of what it was like to be gay in New York or San Francisco pre AIDS? They make me happy.,https://www.reddit.com/r/gaybros/comments/idk6vc/hey_could_yall_tell_more_stories_of_what_it_was/,pmaurant,1,2020-08-20 15:16:31,9,/r/gaybros/comments/idk6vc/hey_could_yall_tell_more_stories_of_what_it_was/,NaN,"I just really like those stories.  I have HIV and despite being undetectable, with a normal ammout if CD4 cells the virus is damaging my peripheral nervous system.  I really need something to pick me up now."
j828rm,Feelings around covid pandemics vs. AIDS crisis as a gay man,https://www.reddit.com/r/gaybros/comments/j828rm/feelings_around_covid_pandemics_vs_aids_crisis_as/,TA695049,1,2020-10-09 09:32:19,2,/r/gaybros/comments/j828rm/feelings_around_covid_pandemics_vs_aids_crisis_as/,NaN,[removed]
k4jdop,World AIDS Day 2020: Remembering the greatest and most effective radical activist group in modern history. Our community was being decimated and the Reagan/Bush regime was literally openly laughing about it during press briefings. ACT UP supercharged the gay rights movement in America by aggressive,https://youtu.be/EC0_EbTVZXE,NDK45,1,2020-12-01 03:45:40,0,/r/gaybros/comments/k4jdop/world_aids_day_2020_remembering_the_greatest_and/,Misc,
k4k0d9,"World AIDS Day: A tribute to the greatest, most effective radical activist group in modern history. Our community was being decimated, the US government was literally openly laughing about it during press briefings. ACT UP supercharged gay rights in America by aggressive force.",https://youtu.be/ChNMaCY1apE,NDK45,1,2020-12-01 04:34:01,1,/r/gaybros/comments/k4k0d9/world_aids_day_a_tribute_to_the_greatest_most/,Misc,
k4u0b2,In honor of world aids day: My T-Shirt from the 1992 Aidswalk. This simple shirt is just a tiny piece of history. I’m thinking of those who lost their lives today.....,https://i.redd.it/ab4wavla3n261.jpg,Fashionlvr_,1,2020-12-01 13:00:07,2,/r/gaybros/comments/k4u0b2/in_honor_of_world_aids_day_my_tshirt_from_the/,NaN,
k4wddi,What nobody talks about on World AIDS day...,https://www.reddit.com/r/gaybros/comments/k4wddi/what_nobody_talks_about_on_world_aids_day/,biotechdj,1,2020-12-01 14:58:16,7,/r/gaybros/comments/k4wddi/what_nobody_talks_about_on_world_aids_day/,NaN,"On World AIDS Day there's plenty of talk about prevention and testing. There's talk about the new HAART drugs and PrEP. There's talk about how many died in the past and how things have gotten better.

On World AIDS Day nobody fucking talks about living with the stigma of hiv and aids. I'm 2018 an estimated 37.9 million people were living with hiv worldwide and no one is talking about the crisis of stigma.

Stigma is becoming more dangerous than HIV. I wonder how many people have died from the stigma surrounding HIV. How many people have taken their lives, unable to cope. How many people are starved for touch or even conversation once they reveal their diagnosis.

World AIDS Day is a day that had lost its potency if it can't help those currently suffering.

How many people have you blocked on apps, ignored, or swiped left on because of their status. It's not because you're afraid, it's because you're ignorant.

U=U. Undetectable equals Untransmittable."
kfzh36,An Oral History of Fashion’s Response to the AIDS Epidemic,https://www.vogue.com/aids-epidemic-oral-history,Mr_Bovary,2,2020-12-18 18:34:47,1,/r/gaybros/comments/kfzh36/an_oral_history_of_fashions_response_to_the_aids/,Misc,
lg223z,Can someone tell me how HIV/AIDS came to be associated with gay men?,https://www.reddit.com/r/gaybros/comments/lg223z/can_someone_tell_me_how_hivaids_came_to_be/,Forgetthelandabove,1,2021-02-09 04:10:09,14,/r/gaybros/comments/lg223z/can_someone_tell_me_how_hivaids_came_to_be/,NaN,"and don't tell me to google it.

I don't get it. How can two HIV negative men just somehow produce HIV just by having sex? Unless it originates somewhere else and a gay man accidentally caught it and spread it. If that's the case then the issue would not be gay sex but rather promiscuity."
lm93t9,The man who mocked gay AIDS patients is dead,https://i.redd.it/hl5on2byr4i61.jpg,CynicalPastaAlfredo,1,2021-02-17 16:29:05,252,/r/gaybros/comments/lm93t9/the_man_who_mocked_gay_aids_patients_is_dead/,Politics/News,
lmthku,Hey what’s the likelihood of get HIV/AIDS from a bj?,https://www.reddit.com/r/gaybros/comments/lmthku/hey_whats_the_likelihood_of_get_hivaids_from_a_bj/,Yomans_6,1,2021-02-18 10:27:25,6,/r/gaybros/comments/lmthku/hey_whats_the_likelihood_of_get_hivaids_from_a_bj/,Sex/Dating,I’m curious about this. Because I think most people assume you’ll get it the same as if you bareback unprotected but I know there are different factors as to getting it. If someone can tell me the likelihood of getting HIV from a bj it would be helpful :)
lqnlju,"#SayTheirNames Campaign featuring Boomer Banks on Instagram, Please follow to Save the First AIDS Memorial in NYC, and for more Celebrities like Aquaria, Dame Emma Thompson, Queen guitarist Brian May, Nathan Lane, Karamo Brown and Many More! @VillageAIDSMemorial",https://v.redd.it/dwdr8po2g9j61,VillageAIDSMemorial,22,2021-02-23 09:16:33,2,/r/gaybros/comments/lqnlju/saytheirnames_campaign_featuring_boomer_banks_on/,NaN,
mzbe6z,"Why I came out as HIV-positive after getting my Covid-19 vaccine - By revealing my HIV status, I could make a statement about fighting the silence and stigma surrounding the continuing pandemic of HIV/AIDS.",https://www.statnews.com/2021/03/26/a-vaccine-for-my-shame/,SetMau92,1,2021-04-26 16:45:06,1,/r/gaybros/comments/mzbe6z/why_i_came_out_as_hivpositive_after_getting_my/,Health/Body,
