4k8bfk,Meet the woman who cared for hundreds of abandoned gay men dying of AIDS,http://www.out.com/positive-voices/2016/5/19/meet-woman-who-cared-hundreds-abandoned-gay-men-dying-aids,d-mac-,655,2016-05-20 06:49:28,52,/r/gaybros/comments/4k8bfk/meet_the_woman_who_cared_for_hundreds_of/,NaN,
4kfy6i,Step closer to AIDS cure: US scientists ‘cut out’ HIV DNA from infected animals,https://www.rt.com/usa/343841-hiv-cure-animals-dna/,phallic_candy_bar,51,2016-05-21 16:01:17,12,/r/gaybros/comments/4kfy6i/step_closer_to_aids_cure_us_scientists_cut_out/,NaN,
4llvfp,"Sanders attacks top AIDS activist, partners with anti-PrEP group",http://americablog.com/2016/05/sanders-attacks-top-aids-activist-partners-anti-prep-group.html,somekook,0,2016-05-29 12:37:51,48,/r/gaybros/comments/4llvfp/sanders_attacks_top_aids_activist_partners_with/,NaN,
4m5uok,Is anyone else doing AIDS Life/Cycle?,https://www.reddit.com/r/gaybros/comments/4m5uok/is_anyone_else_doing_aids_lifecycle/,LAjhawk13,8,2016-06-01 23:21:31,5,/r/gaybros/comments/4m5uok/is_anyone_else_doing_aids_lifecycle/,NaN,"I'm pretty stoked about it, anyone else going to be cycling or participating as a roadie at all?"
4r4qv4,CNN:The Eighties on Demand has a great documentary on AIDS,https://www.reddit.com/r/gaybros/comments/4r4qv4/cnnthe_eighties_on_demand_has_a_great_documentary/,tommygunz007,0,2016-07-03 17:55:21,0,/r/gaybros/comments/4r4qv4/cnnthe_eighties_on_demand_has_a_great_documentary/,NaN,[removed]
4s4vza,"AIDS epidemic no longer a public health issue in Australia, scientists say",http://www.abc.net.au/news/2016-07-10/the-ends-of-aids-as-a-public-health-issue-in-australia/7580852,Oz_93,76,2016-07-10 02:49:22,12,/r/gaybros/comments/4s4vza/aids_epidemic_no_longer_a_public_health_issue_in/,NaN,
4tjngc,"The HIV/AIDS pandemic, explained in 9 maps and charts",http://www.vox.com/2015/12/1/9814026/world-aids-day-2015-hiv-awareness,ghostofpennwast,1,2016-07-18 23:04:00,0,/r/gaybros/comments/4tjngc/the_hivaids_pandemic_explained_in_9_maps_and/,NaN,
4txrak,"TIL in an L.A.Times poll in 1987, 29% of people favored tattooing people who tested positive for AIDS virus.",http://articles.latimes.com/1987-07-31/news/mn-217_1_aids-virus,bass-,40,2016-07-21 09:09:59,22,/r/gaybros/comments/4txrak/til_in_an_latimes_poll_in_1987_29_of_people/,NaN,
4uro49,i am cycling for the cause - northeast AIDS ride (Fundraising),https://i.redd.it/qg72964q2obx.jpg,jeffynihao,1,2016-07-26 16:35:59,1,/r/gaybros/comments/4uro49/i_am_cycling_for_the_cause_northeast_aids_ride/,NaN,
4urqjk,I Am Cycling for the cause -- northeast AIDS Fundraiser,https://www.reddit.com/r/gaybros/comments/4urqjk/i_am_cycling_for_the_cause_northeast_aids/,closetapollo,6,2016-07-26 16:51:05,4,/r/gaybros/comments/4urqjk/i_am_cycling_for_the_cause_northeast_aids/,NaN,"Hellooooo Gaybros,

I wanted to reach out to this community for support. I am fundraising for The LGBT Community Center (gaycenter.org), specifically through Cycle for the Cause - the Northeast AIDS ride. All donations will go to treating and/or preventing HIV/AIDS.

Cycle for the Cause is an epic four day, 275 mile bike ride from Boston to New York in mid-September. It is an organized fundraising ride to raise funds and awareness in the fight against HIV/AIDS. It will also allow The Center to continue providing a safe place for LGBT people. My goal is to fund-raise $2000 this year.
.

All donations are SO SO SO appreciated, and I promise I will peddle my heart out on the ride for you.

You can donate at http://c4c16.kintera.org/hendrix

Find out more about the ride: http://cycleforthecause.org/

Message me if you're interested in joining the ride!
--

just for shits and giggles, and to show you how much I love y'all...here is a GIF of (fatter) me devouring cookies: http://giphy.com/gifs/l46CrzBSjvjyJSBCo"
4w25cy,There's A new subreddit for HIV/AIDS advocates called /r/ActUp. Please consider joining.,https://www.reddit.com/r/gaybros/comments/4w25cy/theres_a_new_subreddit_for_hivaids_advocates/,buddy_cole,11,2016-08-03 18:47:14,1,/r/gaybros/comments/4w25cy/theres_a_new_subreddit_for_hivaids_advocates/,NaN,"Whether you are a health care provider, someone who is HIV positive, or someone who understands the issues surrounding HIV, one thing that I think this site could build upon is its support for those communities. I have created a new community, called /r/ActUp to support a more pointed response to the clinical discussions that we have here.

The discussions about HIV here are valuable, but as the most recent HIV study represented (a study that showed that mixed couples don't transmit HIV, something that mixed couples have reported anecdotally for decades), we must have a place to discuss things that lead science to their conclusions besides simply being clinical and telling people that NO you're NOT HIV+. We need a place to be public, and be aggressive about our reaction to discrimination towards those with HIV and counteract those times and places. Please consider joining and contributing.

I decided to name the subreddit after the name of the famous reactionary group in NYC during the AIDS crisis because of their action and advocacy. If it's a terrible idea, then we can try a different approach with a same idea but a different name, and let me know.

I hope to see you all soon, and let's get HIV/AIDS to be a part of history!"
4y3rd9,Gay Republican Activist Removed from AIDS Foundation for Supporting Donald Trump,http://www.breitbart.com/tech/2016/08/16/gay-republican-activist-removed-from-aids-foundation-for-supporting-donald-trump/,ghostofpennwast,1,2016-08-16 21:32:21,0,/r/gaybros/comments/4y3rd9/gay_republican_activist_removed_from_aids/,NaN,
512cme,Last night I had sex (1st time) I bottomed. Top wore a condom and now I'm irrationally afraid somehow I got aids or disease.,https://www.reddit.com/r/gaybros/comments/512cme/last_night_i_had_sex_1st_time_i_bottomed_top_wore/,mysticalzebra,0,2016-09-03 20:39:59,8,/r/gaybros/comments/512cme/last_night_i_had_sex_1st_time_i_bottomed_top_wore/,NaN,[removed]
52mq08,"Humans of New York post on love, loss and AIDS. “I’d grown up thinking that I’d never be loved. Then a wonderful person loved me. And I left him to have sex with somebody who wasn’t a wonderful person. Jack died thirty years ago. I dream about him almost every night.” [x-post /r/ainbow]",http://www.humansofnewyork.com/post/150337293306/the-first-time-i-met-jack-i-thought-to-myself,joeycastillo,416,2016-09-13 13:31:22,26,/r/gaybros/comments/52mq08/humans_of_new_york_post_on_love_loss_and_aids_id/,NaN,
58wqza,"Horrible! ""Clinton Foundation conspired with Big Pharma to keep the prices of AIDS drugs high"" - WikiLeaks",https://mobile.twitter.com/Cernovich/status/789669509523091457,return2ozma,0,2016-10-22 20:07:11,2,/r/gaybros/comments/58wqza/horrible_clinton_foundation_conspired_with_big/,NaN,
5adak5,"So i'm young,and dumb but why are we more prone yo AIDS",https://www.reddit.com/r/gaybros/comments/5adak5/so_im_youngand_dumb_but_why_are_we_more_prone_yo/,[deleted],1,2016-10-31 09:36:24,0,/r/gaybros/comments/5adak5/so_im_youngand_dumb_but_why_are_we_more_prone_yo/,NaN,[deleted]
5adb4k,How are we more prone to AIDS,https://www.reddit.com/r/gaybros/comments/5adb4k/how_are_we_more_prone_to_aids/,Rightman1027,0,2016-10-31 09:38:59,9,/r/gaybros/comments/5adb4k/how_are_we_more_prone_to_aids/,NaN,[removed]
5bl7ex,"""1970s and ‘Patient 0’ HIV-1 genomes illuminate early HIV/AIDS history in North America"" [Nature] | French Canadian Airline steward Gaétan Dugas exonerated and found not to be the man who brought HIV to the United States.",http://www.nature.com/news/hiv-s-patient-zero-exonerated-1.20877,karmaranovermydogma,51,2016-11-07 01:01:50,4,/r/gaybros/comments/5bl7ex/1970s_and_patient_0_hiv1_genomes_illuminate_early/,NaN,
5fx23v,Because it's AIDS-awareness day. Kind of NSFW.,https://www.youtube.com/watch?v=V-b3UhnwMFU&amp;feature=youtu.be,Eljasaur,36,2016-12-01 07:14:06,1,/r/gaybros/comments/5fx23v/because_its_aidsawareness_day_kind_of_nsfw/,NaN,
5fy2ms,World Aids Day: Why male couples should think about HIV in their relationships,http://theconversation.com/why-male-couples-should-think-about-hiv-in-their-relationships-68895,gaygayguy,1,2016-12-01 10:06:09,1,/r/gaybros/comments/5fy2ms/world_aids_day_why_male_couples_should_think/,NaN,
5g3c6m,"Interesting piece about PreP and sex: ""AIDS Taught Me Sex Was Deadly. A Pill Changed That.""",http://www.villagevoice.com/news/aids-taught-me-sex-was-deadly-a-pill-changed-that-9401834,ThatByrningFeeling,55,2016-12-02 05:50:20,13,/r/gaybros/comments/5g3c6m/interesting_piece_about_prep_and_sex_aids_taught/,NaN,
5i7apo,"the National Center for Complementary and Alternative Medicine once spent $666,000 in federal research money to study whether prayer could heal AIDS. (X-Post TIL)",http://www.chicagotribune.com/lifestyles/health/ct-met-nccam-overview-20111211-story.html,BigOldQueer,20,2016-12-13 16:16:30,10,/r/gaybros/comments/5i7apo/the_national_center_for_complementary_and/,NaN,
5payx0,Trump Shuts Down White House Office of National AIDS Policy: Source,http://www.kennethinthe212.com/2017/01/trump-shuts-down-white-house-office-of.html,[deleted],3,2017-01-21 06:58:50,0,/r/gaybros/comments/5payx0/trump_shuts_down_white_house_office_of_national/,NaN,[deleted]
5v7thw,I just tested HIV/AIDS negative but....,https://www.reddit.com/r/gaybros/comments/5v7thw/i_just_tested_hivaids_negative_but/,risepure,0,2017-02-20 14:54:06,7,/r/gaybros/comments/5v7thw/i_just_tested_hivaids_negative_but/,NaN,[removed]
5zefc3,"Michael Weinstein, president of AIDS Healthcare Foundation, donated $3 million of organization funds to support a failed campaign to restrict LA housing development. How does this make you feel about AHF?",http://www.pinknews.co.uk/2017/03/13/aids-charity-squandered-millions-on-failed-los-angeles-planning-law-battle/,nyugu,1,2017-03-14 12:45:47,1,/r/gaybros/comments/5zefc3/michael_weinstein_president_of_aids_healthcare/,NaN,
63ctib,Ending HIV Campaign Educational video from the new zealand Aids foundation (and hot guys...) [nSFW],https://www.youtube.com/watch?v=LzDHYuEltTw,darby69,159,2017-04-04 01:05:41,19,/r/gaybros/comments/63ctib/ending_hiv_campaign_educational_video_from_the/,NaN,
6cdriq,"For the gaymoviergoers who follow the Cannes Film Festival: ""AIDS Drama 120 Beats Per Minute Is a Vital New Gay Classic"" (Variety Review)",http://www.vanityfair.com/hollywood/2017/05/120-beats-per-minute-cannes-movie-review,[deleted],1,2017-05-20 17:33:22,0,/r/gaybros/comments/6cdriq/for_the_gaymoviergoers_who_follow_the_cannes_film/,NaN,[deleted]
6cds70,"""AIDS Drama 120 Beats Per Minute Is a Vital New Gay Classic"" (Variety Reviews new Cannes Film Festival's Front Runner)",http://www.vanityfair.com/hollywood/2017/05/120-beats-per-minute-cannes-movie-review,IdontSparkle,12,2017-05-20 17:37:20,0,/r/gaybros/comments/6cds70/aids_drama_120_beats_per_minute_is_a_vital_new/,NaN,
6hy74d,"Six People Have Resigned From Trump's HIV/AIDS Advisory Council Because He ""Doesn't Care""",https://www.buzzfeed.com/davidmack/trump-hiv-aids-pacha-resignations?utm_term=.dsZ1b7jZl#.ocEGmo3j9,CyndaquilFire35,139,2017-06-17 22:54:31,22,/r/gaybros/comments/6hy74d/six_people_have_resigned_from_trumps_hivaids/,NaN,
6i0byu,Six resign from presidential HIV/AIDS council because Trump 'doesn't care',http://www.msn.com/en-us/news/us/six-resign-from-presidential-hiv-aids-council-because-trump-doesnt-care/ar-BBCOJll?li=BBnb7Kz,[deleted],1,2017-06-18 08:53:12,0,/r/gaybros/comments/6i0byu/six_resign_from_presidential_hivaids_council/,NaN,[deleted]
6jkbqt,"Excerpt from Randy Shilts' 1987 book ""And the Band Played On; Politics, People, and the AIDS Epidemic""",http://i.imgur.com/w9zWjXo.jpg,Bermo5599,17,2017-06-26 03:44:57,14,/r/gaybros/comments/6jkbqt/excerpt_from_randy_shilts_1987_book_and_the_band/,NaN,
6k1nes,"From 2015, but a lovely gut-wrenching story about the woman who cared for aids victims",https://www.out.com/positive-voices/2016/5/19/meet-woman-who-cared-hundreds-abandoned-gay-men-dying-aids,Tears0FJoy,53,2017-06-28 09:21:52,6,/r/gaybros/comments/6k1nes/from_2015_but_a_lovely_gutwrenching_story_about/,NaN,
6ma9up,"In Memory of Nelsan Ellis' : ""AIDS BURGER"" a Brilliant Scene From True Blood.",https://www.youtube.com/watch?v=H7l-VVxCLo8,IdontSparkle,424,2017-07-09 14:59:08,9,/r/gaybros/comments/6ma9up/in_memory_of_nelsan_ellis_aids_burger_a_brilliant/,NaN,
6oolst,The forgotten fighters of the AIDS epidemic - an article about the dark history of AIDS during the first epidemic,https://www.interestingshit.com/culture/forgotten-fighters-aids-epidemic/,LawlietteL,77,2017-07-21 08:25:32,5,/r/gaybros/comments/6oolst/the_forgotten_fighters_of_the_aids_epidemic_an/,NaN,
6vv7sc,BLM Protesters Disrupt Montreal Pride During Moment of Silence For AIDS and Hate Crime Victims,http://www.back2stonewall.com/2017/08/blm-protesters-disrupt-montreal-pride-moment.html,xbettel,107,2017-08-24 17:55:27,78,/r/gaybros/comments/6vv7sc/blm_protesters_disrupt_montreal_pride_during/,NaN,
72fdwb,Got aids from my first guy,https://www.reddit.com/r/gaybros/comments/72fdwb/got_aids_from_my_first_guy/,[deleted],1,2017-09-25 13:49:52,1,/r/gaybros/comments/72fdwb/got_aids_from_my_first_guy/,NaN,[removed]
74zcvq,"So this keeps popping up on my feed, do you guys have any input? Apparently California decided to change the punishment for knowingly spreading AIDs from a felony with 3/5/8 years in prison to a misdemeanor with only 6 months. This is the first I hear of this.",https://leginfo.legislature.ca.gov/faces/billTextClient.xhtml?bill_id=201720180SB239,mresancho1,9,2017-10-07 19:58:19,11,/r/gaybros/comments/74zcvq/so_this_keeps_popping_up_on_my_feed_do_you_guys/,NaN,
7giopd,Obama has a message on aids,https://www.google.ca/amp/mashable.com/2017/11/29/obama-talks-fight-against-aids-on-kimmel.amp,partofthe,17,2017-11-29 17:47:55,14,/r/gaybros/comments/7giopd/obama_has_a_message_on_aids/,NaN,
7gp33f,"I Remember My Best Friend Tim on December 1st, World AIDS Day",http://torontopubliclibrary.typepad.com/arts_culture/2017/11/on-december-1st-world-aids-day-i-remember-my-best-friend-tim-.html,TPL_on_Reddit,18,2017-11-30 11:54:58,3,/r/gaybros/comments/7gp33f/i_remember_my_best_friend_tim_on_december_1st/,NaN,
7gqakl,World AIDS day. For Gaybros out there living with HIV/AIDS,https://livinggaybrisbane.com/2017/12/01/world-aids-day/,LivingGayBrisbane,25,2017-11-30 14:37:46,0,/r/gaybros/comments/7gqakl/world_aids_day_for_gaybros_out_there_living_with/,NaN,
7gvp19,AIDS Awareness Day Today!,https://i.redd.it/c8145j7qxb101.jpg,whynotitsjustme,55,2017-12-01 07:30:40,3,/r/gaybros/comments/7gvp19/aids_awareness_day_today/,NaN,
7gw4fb,World AIDs Day - I am Me,http://nicodecastro.com/wad2017/,[deleted],1,2017-12-01 08:33:10,0,/r/gaybros/comments/7gw4fb/world_aids_day_i_am_me/,NaN,[deleted]
7gx155,World AIDS Day &amp; AIDS/LifeCycle Shout Out,https://www.reddit.com/r/gaybros/comments/7gx155/world_aids_day_aidslifecycle_shout_out/,txhoosier,6,2017-12-01 10:39:08,3,/r/gaybros/comments/7gx155/world_aids_day_aidslifecycle_shout_out/,NaN,"Hi Bros, 

I've decided to ride in the 2018 AIDS/LifeCycle from SF to LA next June, and I'm wondering if any of y'all have done the ride in the past? If so, what are some tips? How was it? Are you doing it again?! 

For those of you who don't know, the ride is 545 miles and approximately 3,000 people participate, with all proceeds going to AIDS services in Sf and LA. You can learn more about the ride and consider donating towards my fundraising efforts here - http://www.tofighthiv.org/site/TR?px=3364623&amp;fr_id=2050&amp;pg=personal

Thanks!!

Brice"
7htetu,Christmas shopping? Try giving aids!,https://i.redd.it/4k70w4jlk6201.jpg,[deleted],0,2017-12-05 14:32:19,2,/r/gaybros/comments/7htetu/christmas_shopping_try_giving_aids/,NaN,[deleted]
7hv1sr,Looking for a Christmas gift? How about aids!,https://i.redd.it/t5l6dr8ct7201.jpg,NomadicManiac_x,7,2017-12-05 18:43:05,3,/r/gaybros/comments/7hv1sr/looking_for_a_christmas_gift_how_about_aids/,NaN,
7mt12j,AIDS Infection: Gay for the Stay | Love is a Rainbow,https://loveisarainbow.com/2017/11/aids-infection-gay/,WhatIsYourColor,1,2017-12-29 00:01:48,1,/r/gaybros/comments/7mt12j/aids_infection_gay_for_the_stay_love_is_a_rainbow/,NaN,
7mu9w9,Trump fires HIV/AIDS Council in its entirety via letter,http://www.newsweek.com/trump-fires-hivaids-council-its-entirety-fedex-letter-report-claims-763737,sagan_drinks_cosmos,184,2017-12-29 05:21:26,32,/r/gaybros/comments/7mu9w9/trump_fires_hivaids_council_in_its_entirety_via/,NaN,
7mwev1,Trump fires all members of HIV/AIDS council without explanation,http://washingtonblade.com/2017/12/28/tru,boodyclap,15,2017-12-29 11:25:35,3,/r/gaybros/comments/7mwev1/trump_fires_all_members_of_hivaids_council/,NaN,
7uvwln,"Aids Healthcare foundation; if you're in the U.S. - http://www.ahf.org - has specialty pharmacies and Doctors. They work with you to make the HIV disease manageable and affordable. A Friday night out? $100. If everyone who went out tonight volunteered a Benjamin..?Please, donate today.",http://www.ahf.org/,xatian,4,2018-02-02 16:26:52,1,/r/gaybros/comments/7uvwln/aids_healthcare_foundation_if_youre_in_the_us/,NaN,
80vtpj,"'Gross faggot, die of AIDS' Gus Kenworthy reveals shocking homophobic abuse for being gay Olympian",https://www.pinknews.co.uk/2018/02/28/gus-kenworthy-homophobic-abuse/,[deleted],1,2018-02-28 04:55:31,1,/r/gaybros/comments/80vtpj/gross_faggot_die_of_aids_gus_kenworthy_reveals/,NaN,[deleted]
8d78o7,The Trump administration is paying Focus on the Family to stop the AIDS epidemic in South Africa,https://thinkprogress.org/focus-on-the-family-south-africa-aids-grant-purity-pledges-ae8ff7ca0815/,Elranzer,24,2018-04-18 10:02:22,4,/r/gaybros/comments/8d78o7/the_trump_administration_is_paying_focus_on_the/,NaN,
8eu3qi,Listen to Ronald Reagan's press secretary laugh about gay people dying of AIDS,http://www.slate.com/blogs/outward/2015/12/01/reagan_press_secretary_laughs_about_gay_people_dying_of_aids.html,Elranzer,5,2018-04-25 07:46:13,0,/r/gaybros/comments/8eu3qi/listen_to_ronald_reagans_press_secretary_laugh/,NaN,
8r3va9,will i get AIDS? and 68 other questions to NEVER ask a gay person,https://youtu.be/l4_MgsnZ3C8,TrappedInLimbo,3,2018-06-14 10:45:28,0,/r/gaybros/comments/8r3va9/will_i_get_aids_and_68_other_questions_to_never/,NaN,
8tgfgv,what are quality films/TV series about gay bros that are not about HIV/AIDS?​,https://www.reddit.com/r/gaybros/comments/8tgfgv/what_are_quality_filmstv_series_about_gay_bros/,gayrabtop,1,2018-06-24 01:03:15,1,/r/gaybros/comments/8tgfgv/what_are_quality_filmstv_series_about_gay_bros/,NaN,[removed]
8y5fwq,"Cue the HIV outbreaks and rise in AIDS-related deaths, because Trump is coming for HIV/AIDS funding",https://www.pinknews.co.uk/2018/07/11/trump-drains-hivaids-funding-to-pay-for-child-migrant-detention/,Monakh,1,2018-07-11 18:27:42,1,/r/gaybros/comments/8y5fwq/cue_the_hiv_outbreaks_and_rise_in_aidsrelated/,NaN,
93944p,Welcome to the Next Deadly AIDS Pandemic,https://foreignpolicy.com/2018/07/25/welcome-to-the-next-deadly-aids-pandemic/,8cockjockeyD,28,2018-07-30 16:15:44,20,/r/gaybros/comments/93944p/welcome_to_the_next_deadly_aids_pandemic/,NaN,
9rwab2,A man lies down on the AIDS quilt during the 1993 gay and lesbian march on Washington. [1200x800],https://i.redd.it/ta9w4nduypu11.png,lpisme,1,2018-10-27 10:57:21,10,/r/gaybros/comments/9rwab2/a_man_lies_down_on_the_aids_quilt_during_the_1993/,NaN,
9wq73f,"Comic about AIDS, HIV and PrEP by Silver",https://www.ohjoysextoy.com/aids-hiv-prep-silver/,lysdexic__,1,2018-11-13 07:51:43,9,/r/gaybros/comments/9wq73f/comic_about_aids_hiv_and_prep_by_silver/,NaN,
9xrwpz,"TIL that after being sworn in in 1987. Nancy Pelosi was asked if she wanted to address the chamber (after being privately told to decline to the offer when asked). she accepted, and her only statement was ""I came here to fight against HIV/AIDS.""",https://www.reddit.com/r/gaybros/comments/9xrwpz/til_that_after_being_sworn_in_in_1987_nancy/,throwaway16394926,1,2018-11-16 16:34:40,0,/r/gaybros/comments/9xrwpz/til_that_after_being_sworn_in_in_1987_nancy/,NaN,
a1u6l1,The first panel made for the AIDS memorial quilt,https://i.imgur.com/jNSyyYs.jpg,K1nsey6,1,2018-11-30 08:57:16,4,/r/gaybros/comments/a1u6l1/the_first_panel_made_for_the_aids_memorial_quilt/,NaN,
a1uo57,Mike Pence fails to mention gay people in World AIDS Day speech. He only spoke about straight victims of the AIDS crisis.,https://www.pinknews.co.uk/2018/11/30/mike-pence-world-aids-day-speech/,NumberMuncher,1,2018-11-30 09:48:56,2,/r/gaybros/comments/a1uo57/mike_pence_fails_to_mention_gay_people_in_world/,NaN,
a7tfw9,"Looking back, fighting to keep bathhouses open during the early hiv/aids epidemic was a mistake.",https://www.reddit.com/r/gaybros/comments/a7tfw9/looking_back_fighting_to_keep_bathhouses_open/,Vanrayy12,1,2018-12-19 18:32:59,0,/r/gaybros/comments/a7tfw9/looking_back_fighting_to_keep_bathhouses_open/,NaN,[removed]
a8nv1o,"Amitabh Desai on lowering AIDS drug prices-- ""We have always told the drug companies that we would not pressure them and create a slippery slope where prices they negotiate with us for poor countries would inevitably lead to similar prices in rich countries.""",https://wikileaks.org/podesta-emails/emailid/24440,SophieSnuggleBug,1,2018-12-22 11:54:15,2,/r/gaybros/comments/a8nv1o/amitabh_desai_on_lowering_aids_drug_prices_we/,Politics/News,
aicdxn,"“Years from now, people looking back at us will find our acceptance of the HIV theory of AIDS as silly as we find the leaders who excommunicated Galileo” - Kary Mullis, Nobel laureate",http://www.davidpratt.info/aids.htm,Occultgay124,1,2019-01-21 09:31:04,0,/r/gaybros/comments/aicdxn/years_from_now_people_looking_back_at_us_will/,NaN,
al8plb,"FATHERS Ep 1, by Leo Herrera 2018 / If AIDS never happened, who would we be? Episode one of the Web series will explore sex, politics, nightlife in this alternate universe.",https://vimeo.com/274603075,partyzanenz,1,2019-01-29 19:55:20,0,/r/gaybros/comments/al8plb/fathers_ep_1_by_leo_herrera_2018_if_aids_never/,NaN,
aunsaf,Ally here. I have a few thoughts regarding Rami Malek's lack of acknowledgement of HIV/AIDS,https://www.reddit.com/r/gaybros/comments/aunsaf/ally_here_i_have_a_few_thoughts_regarding_rami/,blind_venetians,40,2019-02-25 09:30:10,16,/r/gaybros/comments/aunsaf/ally_here_i_have_a_few_thoughts_regarding_rami/,NaN,"Straight, 50-something male, reasonably educated health care professional, ally here.  I got on Reddit just now to search this VERY topic and I want to share my two cents.  I offered up the following in another post, but thought it might serve well as a stand alone post.  If that's not allowed, mods do your thing....

It was a miss on Malek's part not to recognize the disease that took Freddie, a rock and roll legend and HIV/AIDS icon.   I'm not suggesting some sort of career controversy but it was a faux pax nonetheless.   Frankly, I'm scratching my head a bit as to how there wasn't a coordinated recognition and positive capitalization of this moment on the timeline of HIV/AIDS history especially given Elton John's place in Oscar culture with the AIDS Foundation after party.  I'm old enough to have a best friend who lost a brother\* to AIDS at a time of intense secrecy and isolation and even greater stigma.  A time when people wouldn't shake my friend's hand so they wouldn't catch the ""gay disease"".  I'm so grateful to have seen those days pass and we now see greater awareness and inclusivity.   Now we see medical treatments that can reduce the virus to a level of undetectable.  There are even meds (Truvada) available to help reduce to the chance of transmission.  But this is not a virus or disease to be slept on and I'm disappointed Malek did not use his platform to offer some acknowledgement of a disease that while not nearly as lethal still very much can be.  Hey, his speech was one of my favorites of the night.  People who remember to thank mom first always rank high with me. And, I thought the rest of it was sincere and heartfelt but this would have just been the most wonderful cherry on top.  If this was some sort of oversight associated with the nerves of being on TV in front of bazillions I will lighten up, but it just seems that it might have been pretty high up on the list of points of recognition.  I guess I'm just saying if people can remember to get in a well earned tRump jab, one might bring a little light to a lethal disease.   HIV is still a thing.  We still need to be reminded that it can be prevented.

&amp;#x200B;

Maybe I'm being overly sensitive, but it could be that AIDS was the ""polio"" of my generation.  While there is plenty to be grateful for there is much to be on guard for as well.  As we can see by the measles epidemics from Madagascar to Washington State, USA things will come back to bite ya in the ass (thanks anti-vaxxers - GFY).  We have to be vigilant.  Get tested.  You are wanted, needed and loved.

&amp;#x200B;

\*His name is Shaun.  He has an early square on The Quilt.  He played piano and tenor sax, designed clothes and had zero f---ks to give as to what you thought about that. He. Was. Fabulous."
awhqwr,Taron Egerton singing Tiny Dancer with Elton on piano at Elton John AIDS Foundation Oscar Viewing Party,https://www.youtube.com/watch?v=rzWSEtahHus,Kin-Of-The-Cosmos,79,2019-03-02 05:26:22,13,/r/gaybros/comments/awhqwr/taron_egerton_singing_tiny_dancer_with_elton_on/,NaN,
axhfzi,Reuters: “London HIV patient becomes world’s second AIDS cure hope”,https://www.reuters.com/article/us-health-aids-cure/london-hiv-patient-becomes-worlds-second-aids-cure-hope-idUSKCN1QL2C0,visit-p,11,2019-03-04 21:27:40,1,/r/gaybros/comments/axhfzi/reuters_london_hiv_patient_becomes_worlds_second/,NaN,
