Post ID,Title,Url,Author,Score,Publish Date,Total No. of Comments,Permalink,Flair,body
qq2zm,This bromo's sex music singlehandedly caused the AIDS crisis,http://www.youtube.com/watch?v=Ew9eLazb_Jw&amp;nomobile=1,eirikeiriksson,1,2012-03-09 23:56:49,0,/r/gaybros/comments/qq2zm/this_bromos_sex_music_singlehandedly_caused_the/,NaN,
r7idi,Mount Sinai School of Medicine researchers have discovered that marijuana-like compounds can inhibit the multiplication of human immunodeficiency virus (HIV) in late-stage AIDS. (x-post from /r/science),http://redd.it/r6s5o,cpatton520,5,2012-03-21 16:22:44,2,/r/gaybros/comments/r7idi/mount_sinai_school_of_medicine_researchers_have/,NaN,
s4cc2,Sven Sundgaard. Out bro weather man and raises money for AIDS awareness.  Don't oogle him though.,http://imgur.com/a/dQNxK,[deleted],4,2012-04-11 07:16:36,18,/r/gaybros/comments/s4cc2/sven_sundgaard_out_bro_weather_man_and_raises/,NaN,
th9dk,Went to wikipedia to clarify muscle twitches before my bio final.  You gotta love visual aids.,http://upload.wikimedia.org/wikipedia/commons/c/c0/Skeletal_muscle.jpg,nycsurfer,65,2012-05-10 15:58:43,8,/r/gaybros/comments/th9dk/went_to_wikipedia_to_clarify_muscle_twitches/,NaN,
uukyf,"r/HIVAIDS - a subreddit for news, discussion, and support relating to HIV/AIDS. ",http://www.reddit.com/r/hivaids/,tellme_areyoufree,63,2012-06-10 07:09:32,4,/r/gaybros/comments/uukyf/rhivaids_a_subreddit_for_news_discussion_and/,NaN,
w65k5,"Yo. I'm reading this Ask Reddit thread, asking gay men how life was during the AIDS epidemic in the 80's. It's hittin' hard, pullin' a tear out of me, and it's our history, so I wanted to share it with you. ",http://www.reddit.com/r/AskReddit/comments/w5x9w/gay_men_who_were_adults_in_the_early_80s_what_did/,YoungCubSaysWoof,24,2012-07-07 00:23:01,10,/r/gaybros/comments/w65k5/yo_im_reading_this_ask_reddit_thread_asking_gay/,NaN,
x8ue8,Can Circumcision Protect Against AIDS? ,http://allthingsqueer.co.za/archives/health/288-can-circumcision-protect-against-aids.html,laraaucamp,0,2012-07-27 06:13:30,5,/r/gaybros/comments/x8ue8/can_circumcision_protect_against_aids/,NaN,
zd3fy,"The Democratic Party Platform: including plans to support LGBT youth, combatting HIV/AIDS, policies to advance LGBT rights abroad, and marriage equality. I am PROUD to be a Democrat today.",http://www.democrats.org/democratic-national-platform?source=reddit,dareao,94,2012-09-04 16:44:30,45,/r/gaybros/comments/zd3fy/the_democratic_party_platform_including_plans_to/,NaN,
1170ks,"AIDS walk, DC",http://www.reddit.com/r/gaybros/comments/1170ks/aids_walk_dc/,pupster,3,2012-10-09 06:34:01,4,/r/gaybros/comments/1170ks/aids_walk_dc/,NaN,"Dear friendly gaybros, I don't post here too often, but I love this subreddit. I want to do the [AIDS walk, in DC] (http://www.kintera.org/faf/home/default.asp?ievent=1010031&amp;lis=1&amp;kntae1010031=C87413CCE41542EEBEA6E6A1B1A30B54) on October 27 and would love to have some company. Would anyone here be interested? It could also provide opportunity for some social time afterwards!

Thanks and sorry for spamming non-DC bros. [Compensatory cute boy link.](http://cache.gawker.com/assets/images/7/2009/07/gaystudent.jpg) "
11cm8i,"Alright, I need to be educated about HIV/AIDS",http://www.reddit.com/r/gaybros/comments/11cm8i/alright_i_need_to_be_educated_about_hivaids/,[deleted],2,2012-10-11 21:06:56,8,/r/gaybros/comments/11cm8i/alright_i_need_to_be_educated_about_hivaids/,NaN,"If a guy gives me a blow job is there a chance that I can get aids?

What if I get sperm in my mouth by accident, can you get infected by that?

I'm being serious, I'm sort of paranoid right now and need to be calmed with a bit of safe sex education "
11r5w6,"A little help, bros?? AIDS Walk only days away!!",http://www.reddit.com/r/gaybros/comments/11r5w6/a_little_help_bros_aids_walk_only_days_away/,[deleted],4,2012-10-19 09:38:45,0,/r/gaybros/comments/11r5w6/a_little_help_bros_aids_walk_only_days_away/,NaN,"AIDS Walk Austin is in two days.

My nonprofit LGBTQ-centric social athletics group, [Team ProHomo](http://www.facebook.com/AustinTPH), is walking and raising money to fight AIDS for the second year in a row. (See more about Team ProHomo on our Facebook Page above.)

**TODAY ALL DONATIONS ARE MATCHED (in multiples of $25)!!!**

We want to smash our record from last year, but more importantly, we want to help make sure AIDS Services of Austin reaches their goal of $195,000 (at $135,000 at time of post).

The funds raised from AIDS Walk help AIDS Services of Austin provide care for our brothers &amp; sisters fighting AIDS. Your donations can help provide warm meals, medications, beds, HIV tests, and much much more.

**PLEASE** consider donating $25 or more if you are able. I love this incredible subreddit and would love to be able to attribute some of our raised funds to you all! &lt;3


**[DONATE TO TEAM PROHOMO HERE!](https://secure2.convio.net/aidsa/site/Donation2?idb=215062507&amp;df_id=1701&amp;1701.donation=form1&amp;FR_ID=1120&amp;PROXY_ID=9821&amp;PROXY_TYPE=22&amp;JServSessionIdr004=zn3c5umgm4.app210a)**

And hey, if you live in the Austin area, you should definitely come out this Sunday and Walk with us!!!"
12b4ih,"""Sugar Baby Love"" Cute, sexy and funny video for a French AIDS awareness campaign.",http://www.youtube.com/watch?v=E2KD7p1OUlc,lightfoot90,20,2012-10-29 17:13:12,3,/r/gaybros/comments/12b4ih/sugar_baby_love_cute_sexy_and_funny_video_for_a/,NaN,
140a26,"World AIDS Day, December 1",http://www.reddit.com/r/gaybros/comments/140a26/world_aids_day_december_1/,kpatl,13,2012-11-29 11:08:01,2,/r/gaybros/comments/140a26/world_aids_day_december_1/,NaN,"This Saturday is World AIDS Day 2012. This is obviously an issue that gaybros need to aware of. Get tested, buy condoms, talk to your partner(s). A lot of clinics and universities offer free HIV testing tomorrow, at least in the US, so be sure to get checked."
142ssz,"World Aids Day, bros.  GET TESTED.  KNOW YOUR STATUS.  In most cases, it's free and there's no reason not to. (x-post from r/gaymers)",http://i.imgur.com/SO8vM.jpg,iamelben,43,2012-11-30 15:32:25,9,/r/gaybros/comments/142ssz/world_aids_day_bros_get_tested_know_your_status/,NaN,
15pxyf,"""It's okay to get AIDS from a woman but not a man""...",http://www.reddit.com/r/gaybros/comments/15pxyf/its_okay_to_get_aids_from_a_woman_but_not_a_man/,[deleted],1,2012-12-31 03:40:33,0,/r/gaybros/comments/15pxyf/its_okay_to_get_aids_from_a_woman_but_not_a_man/,NaN,"Intro/Background: I am a gay male and I am in my early 20s. My mom found out a few days ago that I am gay and has since isolated me from my family. She's made a number of statements which reflect the mentality of earlier times (she thinks I am going through a phase/experimenting and that I can still be ""cured"") , but the quotation mentioned above ranks right up there. Considering her upbringing and the conditions she was raised in, I can understand where she could be coming from and her recent actions have become ludicrous, but unbearable. I am usually down to earth and just try to avoid getting in an argument with her about this, but now this is crossing the line and I want to do something about her attitude.

I love my mom and I wish she didn't make this so difficult. The reason I am making this post is because I don't know what to do anymore to try to make her see where I am coming from, but she continually refuses. At this point, I just want to give up but before I did that, I thought I could consult my fellow bromos. To those that have an opinion on this matter, what would you do in my situation?  "
1uf85z,Who else is doing the AIDS/LifeCycle (fundraising).,http://www.reddit.com/r/gaybros/comments/1uf85z/who_else_is_doing_the_aidslifecycle_fundraising/,[deleted],16,2014-01-04 15:21:11,1,/r/gaybros/comments/1uf85z/who_else_is_doing_the_aidslifecycle_fundraising/,NaN,"Any other bros participating in the AIDS/LifeCycle? Let's connect.

Also, I need your help. In 21 weeks I will embark on a 545 mile ride from San Francisco to Los Angeles. The purpose is to raise awareness and funds for organizations whose mission is to fight #HIV / #AIDS. If you are looking to donate to a great cause, please consider a donation to the AIDS/LifeCycle. I need to raise a minimum of $3000, but I have set a goal of $5000.

[To make a donation on behalf of calimechengr](http://www.tofighthiv.org/goto/erikasuncion)

Thanks for your consideration!"
1x42g9,"Cycling my first century for Hill Country Ride for AIDS this April, teaming up with my best gaybros! Help me help those in need fighting AIDS. (Any donation much appreciated.) &lt;3",http://www.hillcountryride.org/site/TR/HillCountryRideforAIDS/General?team_id=7730&amp;pg=team&amp;fr_id=1190,[deleted],9,2014-02-05 12:21:21,0,/r/gaybros/comments/1x42g9/cycling_my_first_century_for_hill_country_ride/,NaN,
228ydr,Ugandan HIV/AIDS Organization Raided for 'Training Youths in Homosexuality',http://www.towleroad.com/2014/04/ugandan-hivaids-organization-raided.html#.Uz9_s9Cz90Q.reddit,coldandnervous,1,2014-04-04 20:59:55,0,/r/gaybros/comments/228ydr/ugandan_hivaids_organization_raided_for_training/,NaN,
22qprn,"8 Nude Male Wrestlers Smeared In Jelly, Star In New Swedish Ad For HIV/AIDS Testing (NSFW)",http://www.thegailygrind.com/2013/12/03/nsfw-8-nude-male-wrestlers-smeared-jelly-star-new-swedish-ad-hivaids-testing/,S1RK1T,0,2014-04-10 18:04:45,1,/r/gaybros/comments/22qprn/8_nude_male_wrestlers_smeared_in_jelly_star_in/,NaN,
235ugx,"AIDS org CEO asked to resign after calling Truvada a ""party drug""",http://www.frontiersla.com/positivefrontiers/2014/04/15/michael-weinstein-asked-to-resign-as-head-of-ahf-in-new-petition,fauxjob,1,2014-04-15 23:12:15,4,/r/gaybros/comments/235ugx/aids_org_ceo_asked_to_resign_after_calling/,NaN,
23sps3,Straight bro friend was volunteering for ALPHA (Allies Linked for the Prevention of HIV and AIDS) at a information fair today and sent me this text.,http://imgur.com/KxCnQi7,KillerAndreas,241,2014-04-23 13:23:00,13,/r/gaybros/comments/23sps3/straight_bro_friend_was_volunteering_for_alpha/,NaN,
23toxb,Doing aids/lifecycle for the first time,http://www.reddit.com/r/gaybros/comments/23toxb/doing_aidslifecycle_for_the_first_time/,[deleted],8,2014-04-23 19:12:32,4,/r/gaybros/comments/23toxb/doing_aidslifecycle_for_the_first_time/,NaN,Anyone else?
270djw,"If you have ever wanted to know what the darkest days of the AIDS crisis in the 80s was actually like, the panic, the fear, the confusion, the ignorance both scientifically and socially, this is the best 'documentary' of chronological news clips from the era I have ever seen anywhere.",https://www.youtube.com/watch?v=zPO5wausim8,AndyAndrophile,11,2014-05-31 21:58:23,1,/r/gaybros/comments/270djw/if_you_have_ever_wanted_to_know_what_the_darkest/,NaN,
28ymq3,"Titled ""Robin Hood of the Civil Rights Movement,"" Eddie Sandifer, talks about those days and his life of activism durings 70's and Aids crisis.",http://www.clarionledger.com/story/news/2014/06/21/advocate-robin-hood-civil-rights-movement/11227905/,[deleted],1,2014-06-24 06:00:48,0,/r/gaybros/comments/28ymq3/titled_robin_hood_of_the_civil_rights_movement/,Misc,
29u0i3,It's been 33 years (and a day) since the New York Times broke the AIDS story for the first time. Here's that original article from 1981.,http://www.nytimes.com/1981/07/03/us/rare-cancer-seen-in-41-homosexuals.html?smid=fb-share,[deleted],4,2014-07-04 08:49:17,0,/r/gaybros/comments/29u0i3/its_been_33_years_and_a_day_since_the_new_york/,NaN,
2ajyml,"Nash Grier with 9 million followers on Vine posts homophobic Vine blaming AIDS on ""FAG""!!",https://vine.co/v/M5YdxJW03F1,snackbarclosed,0,2014-07-12 18:52:40,3,/r/gaybros/comments/2ajyml/nash_grier_with_9_million_followers_on_vine_posts/,NaN,
2b2kob,Around 100 Attendees Heading To Australia AIDS Conference Among Victims Of Downed Malaysia Airlines Flight,http://sanfrancisco.cbslocal.com/2014/07/17/around-100-aids-researchers-heading-to-melbourne-conference-aboard-malaysia-airlines-flight-ukraine-russia-aircraft-crash-victims-australia/,itslifeasusual,0,2014-07-18 12:18:08,0,/r/gaybros/comments/2b2kob/around_100_attendees_heading_to_australia_aids/,NaN,
2c7tba,HIV-AIDS Continues to Spread in Region Among White Gay Men,http://stlouis.cbslocal.com/2014/07/30/hiv-aids-continues-to-spread-among-white-gay-men/,[deleted],1,2014-07-30 23:04:44,1,/r/gaybros/comments/2c7tba/hivaids_continues_to_spread_in_region_among_white/,NaN,
2fvv91,Please support my participation in AIDS/LifeCycle,http://www.reddit.com/r/gaybros/comments/2fvv91/please_support_my_participation_in_aidslifecycle/,googly24,0,2014-09-08 23:22:48,3,/r/gaybros/comments/2fvv91/please_support_my_participation_in_aidslifecycle/,NaN,"I’m preparing for a monumental journey and I couldn’t be more excited! It’s not going to be easy, but it’s likely to be one of the most rewarding weeks I will experience in my life. And I need your help to make it possible.

May 31st -June 6th I will ride my bike 545 miles from San Francisco to Los Angeles to support the life-saving services offered by San Francisco AIDS Foundation and the Los Angeles LGBT Center, in the fight to end HIV/AIDS. Preparing for this journey will require countless hours of training and preparation. I’ve committed my time to make sure that I’m ready, but I still need to raise a minimum of $3,000 to ride. For that, I’m asking you to support me by donating as generously as you possibly can. To the people who rely on these services to survive, every dollar counts. And every dollar brings me closer to being able to participate in this once-in-a-lifetime experience. 

In addition to this, I will also be making a personal contribution of $1000 towards organizations working to the betterment of weaker communities in India (Particularly those that work for poverty eradication and educating the society on LGBTQ rights) – so, every dollar you donate to me here is also virtually helping me make that contribution to other noble causes.

Thank you for making this event possible for me and for being the support that I need to cross the finish line on June 6th. Let’s make a difference together! 
Click [here](http://www.tofighthiv.org/site/TR?px=3115197&amp;pg=personal&amp;fr_id=1770&amp;et=avxghvAJZvIXyCwJKln57Q&amp;s_tafId=74796) to visit my personal page.

P.S: In case you're even remotely considering joining me - Jump in.

With love and gratitude,
Guhan
"
2nay2b,"23 years ago, the greatest gay entertainer who ever lived, Freddie Mercury, died of the horrific AIDS at 45. RIP",https://www.youtube.com/watch?v=EPHJFnob8p8,[deleted],305,2014-11-24 13:37:41,65,/r/gaybros/comments/2nay2b/23_years_ago_the_greatest_gay_entertainer_who/,NaN,
2ny23y,"It's World AIDS Day bros - getting tested is scary, but worth it!",http://www.gayrva.com/featured/hiv-testing-is-scary-but-worth-it/,bknutner,210,2014-12-01 07:25:57,48,/r/gaybros/comments/2ny23y/its_world_aids_day_bros_getting_tested_is_scary/,NaN,
2nyw5i,"Hey r/gaybros, for World AIDS day will you beta test our condom startup!?",http://www.reddit.com/r/gaybros/comments/2nyw5i/hey_rgaybros_for_world_aids_day_will_you_beta/,Gorillapp,17,2014-12-01 11:43:49,18,/r/gaybros/comments/2nyw5i/hey_rgaybros_for_world_aids_day_will_you_beta/,NaN,"Hello r/gaybros!!!

We're a healthcare startup looking for beta testers who use condoms at least 5x per month and have iphone updated with iOS8. 

About our product: We are a condom company that places a unique one-time-use QR code on the back of every one of our wrappers. Our QR code is then scanned from our mobile app; each scanned condom represents 1 point. Users race the global community and get to redeem prizes from our sponsors! Safe sex is great sex and as a condom company we just want to make it a little bit more fun ;)

If you're interested in participating in our private beta please PM us and we'll hook you up with a 30 day supply of condoms for FREE!!!

Thank you,

The Gorilla Team"
2rw2ke,"In the darkest hour of the AIDS epidemic, Ruth Coker Burks cared for hundreds of people whose families had abandoned them. Courage, love and the 30-year secret of one little graveyard in Hot Springs.",http://www.arktimes.com/arkansas/ruth-coker-burks-the-cemetery-angel/Content?oid=3602959,amifufu,365,2015-01-09 12:06:16,37,/r/gaybros/comments/2rw2ke/in_the_darkest_hour_of_the_aids_epidemic_ruth/,NaN,
2uise0,What was it like to be a gay man living through the AIDS epidemic? (x-post from /r/askreddit),http://www.reddit.com/r/AskReddit/comments/2ug992/serious_gay_men_who_lived_through_the_hiv/,omicr_on,38,2015-02-02 07:10:25,13,/r/gaybros/comments/2uise0/what_was_it_like_to_be_a_gay_man_living_through/,NaN,
2vup1z,"PSA: SuperHIV, New form of HIV turns into AIDS before victims realise they are infected",http://metro.co.uk/2015/02/13/new-form-of-hiv-turns-into-aids-before-victims-realise-they-are-infected-5062391/,jwax33,50,2015-02-13 22:39:55,34,/r/gaybros/comments/2vup1z/psa_superhiv_new_form_of_hiv_turns_into_aids/,NaN,
3483zq,AIDS/Lifecycle 2015 Help me out!,http://www.reddit.com/r/gaybros/comments/3483zq/aidslifecycle_2015_help_me_out/,[deleted],1,2015-04-28 18:28:34,1,/r/gaybros/comments/3483zq/aidslifecycle_2015_help_me_out/,NaN,
34b9l4,"so like I've got AIDS -- this is why you don't wait to get tested, and don't put off seeing a doctor if you test positive!",http://www.reddit.com/r/gaybros/comments/34b9l4/so_like_ive_got_aids_this_is_why_you_dont_wait_to/,[deleted],11,2015-04-29 12:47:11,1,/r/gaybros/comments/34b9l4/so_like_ive_got_aids_this_is_why_you_dont_wait_to/,NaN,
34ggzx,Hot former military GB raising money for AIDS/LifeCycle 2015!,http://www.reddit.com/r/gaybros/comments/34ggzx/hot_former_military_gb_raising_money_for/,QuincyGuy12,10,2015-04-30 16:08:43,3,/r/gaybros/comments/34ggzx/hot_former_military_gb_raising_money_for/,NaN,"Hey guys posting this my best friend, he is former military GB who is doing his first AIDS/LifeCycle ride from SF to LA. He is ***SO*** close to his goal any amount helps and even if you can't give money some upvotes or words of support in this case really do mean something!! 

[Here is a link to his original post](http://www.reddit.com/r/ainbow/comments/3485s7/aidlifecycle_2015_help_me_reach_my_goal/) 

[Here is a link to his racing team photo :\)](http://i.imgur.com/gWAdeHm.jpg) "
37o9h8,"My favorite clip from The Normal Heart, a tear jerking must see movie about the early AIDS epidemic in the gay community.",https://www.youtube.com/watch?v=jlH1QtFuDGk,BrandosSmolder,30,2015-05-28 19:37:22,5,/r/gaybros/comments/37o9h8/my_favorite_clip_from_the_normal_heart_a_tear/,NaN,
3d5mdk,"Just finished a 200 mile bike ride to raise money for HIV/AIDS charities (along with a couple hundred other homos and friends). As a whole, the event raised over $600,000. Just wanted to share.",http://i.imgur.com/DKXOsds.jpg,tellme_areyoufree,148,2015-07-13 11:35:29,14,/r/gaybros/comments/3d5mdk/just_finished_a_200_mile_bike_ride_to_raise_money/,NaN,
3eanwb,AIDS: Kills Gays Dead,http://www.reddit.com/r/gaybros/comments/3eanwb/aids_kills_gays_dead/,DQPJNAI,1,2015-07-22 23:47:30,1,/r/gaybros/comments/3eanwb/aids_kills_gays_dead/,NaN,
3fgdox,[SS] Queen - These Are The Days Of Our Lives. A beautiful song and a powerful video filmed four months before Freddy Mercury passed away from AIDS.,https://www.youtube.com/watch?v=oB4K0scMysc,ZobeGrnLiteRnr,19,2015-08-01 16:06:58,1,/r/gaybros/comments/3fgdox/ss_queen_these_are_the_days_of_our_lives_a/,NaN,
3fgo9e,"In Some Ways, AIDS In America Has Gotten Worse",http://www.huffingtonpost.com/entry/in-some-ways-aids-in-america-has-gotten-worse_55bba54ce4b06363d5a1f49f?utm_hp_ref=gay-voices&amp;ir=Gay%2BVoices&amp;section=gay-voices,jsucese,32,2015-08-01 17:45:27,26,/r/gaybros/comments/3fgo9e/in_some_ways_aids_in_america_has_gotten_worse/,NaN,
3o1wn8,Institute of Human Virology at University of Maryland officially launched the human testing phase of their HIV/AIDS vaccine,http://www.baltimoresun.com/health/bs-hs-aids-vaccine-20151007-story.html,SensAsianalism,236,2015-10-08 19:29:15,17,/r/gaybros/comments/3o1wn8/institute_of_human_virology_at_university_of/,NaN,
3ovd59,Flashback: The Reagan White House Thought AIDS Was Pretty Hilarious In 1982,http://m.motherjones.com/mixed-media/2014/12/flashback-reagan-white-house-thought-aids-was-pretty-hilarious-1982,TheRadicalAntichrist,7,2015-10-15 08:58:27,0,/r/gaybros/comments/3ovd59/flashback_the_reagan_white_house_thought_aids_was/,NaN,
3p34me,Bernie Sanders Redirects Campaign Donation From Martin Shkreli To AIDS Clinic,http://www.inquisitr.com/2498883/bernie-sanders-redirects-campaign-donation-from-martin-shkreli-to-aids-clinic/,ghostofpennwast,314,2015-10-16 23:42:09,56,/r/gaybros/comments/3p34me/bernie_sanders_redirects_campaign_donation_from/,NaN,
3t6r1b,Let's Not Make Charlie Sheen the Public Face of HIV/AIDS,http://www.theatlantic.com/entertainment/archive/2015/11/its-okay-to-have-sympathy-for-charlie-sheen-and-contempt/416364/,JIVEprinting,268,2015-11-17 10:24:25,100,/r/gaybros/comments/3t6r1b/lets_not_make_charlie_sheen_the_public_face_of/,NaN,
3tsynu,Grim Reaper [1987] - How the AIDS epidemic was portrayed to the Australian public,https://www.youtube.com/watch?v=U219eUIZ7Qo,Oz_93,27,2015-11-22 03:43:45,4,/r/gaybros/comments/3tsynu/grim_reaper_1987_how_the_aids_epidemic_was/,NaN,
3uydix,PrEP and World Aids Day,https://www.reddit.com/r/gaybros/comments/3uydix/prep_and_world_aids_day/,darbssavo,1,2015-11-30 20:15:58,0,/r/gaybros/comments/3uydix/prep_and_world_aids_day/,NaN,[removed]
3uzad6,December 1st is World AIDs Day. Know your status and Fight The Stigma.,https://www.reddit.com/r/gaybros/comments/3uzad6/december_1st_is_world_aids_day_know_your_status/,naughty_ottsel,16,2015-12-01 01:36:01,0,/r/gaybros/comments/3uzad6/december_1st_is_world_aids_day_know_your_status/,NaN,[removed]
3uzxzg,"For National Aids day, Lesbians during the 80s.",https://www.reddit.com/r/AskReddit/comments/2ug992/serious_gay_men_who_lived_through_the_hiv/co8ebx4,iambueno,17,2015-12-01 06:06:39,0,/r/gaybros/comments/3uzxzg/for_national_aids_day_lesbians_during_the_80s/,NaN,
3v0h8p,"World AIDS Day, bros. Get tested!",http://i.imgur.com/LNmxd7K.jpg,maxfunmaker,218,2015-12-01 08:21:02,17,/r/gaybros/comments/3v0h8p/world_aids_day_bros_get_tested/,NaN,
3v0ovo,"[x-post, /r/Science]: World AIDS Day AMA: We’re Drs. Marina Klein and Jean-Pierre Routy and we’re here on World AIDS Day to discuss the pathology and epidemiology of HIV infection.",https://www.reddit.com/r/science/comments/3uznyu/world_aids_day_ama_were_drs_marina_klein_and/,thisdude415,6,2015-12-01 09:07:31,0,/r/gaybros/comments/3v0ovo/xpost_rscience_world_aids_day_ama_were_drs_marina/,NaN,
3v70n4,In honor of World AIDS Day... Remember 33 years ago that AIDS was a joke to the Reagan administration. (xpost from /r/ainbow),https://i.imgur.com/spDcY1t.jpg,nightpanda893,88,2015-12-02 13:13:20,15,/r/gaybros/comments/3v70n4/in_honor_of_world_aids_day_remember_33_years_ago/,NaN,
3v8paq,When AIDS Was Funny. A Short Documentary,http://www.vanityfair.com/news/2015/11/reagan-administration-response-to-aids-crisis,JSIN33,2,2015-12-02 20:40:49,0,/r/gaybros/comments/3v8paq/when_aids_was_funny_a_short_documentary/,NaN,
3w1p97,"World AIDS Day, bros. Get tested!",http://i.imgur.com/LNmxd7K.jpg,congoles1,23,2015-12-08 23:30:35,3,/r/gaybros/comments/3w1p97/world_aids_day_bros_get_tested/,NaN,
40co4d,No more excuses. We have the tools to end the HIV/AIDS pandemic.,https://www.washingtonpost.com/opinions/no-more-excuses-we-have-the-tools-to-end-the-hivaids-pandemic/2016/01/08/a01cc876-b611-11e5-a842-0feb51d1d124_story.html,domo415,237,2016-01-10 11:15:12,103,/r/gaybros/comments/40co4d/no_more_excuses_we_have_the_tools_to_end_the/,NaN,
43x3jz,Survivors of 1980s AIDS crisis reveal what happened to them,http://www.gaystarnews.com/article/survivors-1980s-aids-crisis-reveal-what-happened-them020215/,domo415,1,2016-02-02 16:01:35,0,/r/gaybros/comments/43x3jz/survivors_of_1980s_aids_crisis_reveal_what/,NaN,
4909xy,(Request) AMA with HIV/AIDS Counselors / Doctors / Etc,https://www.reddit.com/r/gaybros/comments/4909xy/request_ama_with_hivaids_counselors_doctors_etc/,gayhereandthere,25,2016-03-04 16:49:29,6,/r/gaybros/comments/4909xy/request_ama_with_hivaids_counselors_doctors_etc/,NaN,"Dear r/gaybros moderators, 

Do you think it's possible to host an AMA thread with HIV/AIDS Counselors, doctors, etc regularly here? 

"
4a0w95,Hillary Clinton Shockingly Praises Nancy Reagan's 'AIDS Activism',http://www.huffingtonpost.com/entry/hillary-clinton-nancy-reagan-aids-activism_us_56e31770e4b0b25c9181e002,pitabread58,8,2016-03-11 13:40:09,10,/r/gaybros/comments/4a0w95/hillary_clinton_shockingly_praises_nancy_reagans/,NaN,
4a6ohb,Hillary Clinton Responds: On the fight against HIV and AIDS—and on the people who really started the conversation.,https://medium.com/@HillaryClinton/on-the-fight-against-hiv-and-aids-and-on-the-people-who-really-started-the-conversation-7b9fc00e6ed8#.tueivdffe,dbdevil1,9,2016-03-12 18:34:28,1,/r/gaybros/comments/4a6ohb/hillary_clinton_responds_on_the_fight_against_hiv/,NaN,
4b35k7,Fundraising for AIDS Ride - Cycle For The Cause,https://www.reddit.com/r/gaybros/comments/4b35k7/fundraising_for_aids_ride_cycle_for_the_cause/,[deleted],1,2016-03-19 06:52:07,1,/r/gaybros/comments/4b35k7/fundraising_for_aids_ride_cycle_for_the_cause/,NaN,[removed]
4e878u,What should I do? My boyfriend was diagnosed with AIDS I'm negative but still what should I do?,https://www.reddit.com/r/gaybros/comments/4e878u/what_should_i_do_my_boyfriend_was_diagnosed_with/,jada858,1,2016-04-10 16:36:57,1,/r/gaybros/comments/4e878u/what_should_i_do_my_boyfriend_was_diagnosed_with/,NaN,[removed]
