mzbi6x,"The Gay Men of “Jerker” Escape AIDS Through the Phone Line Watch a virtual performance of this classic of gay theater, written in 1986. It packs a punch.",https://www.poz.com/blog/gay-men-jerker-escape-aids-phone-line,SetMau92,1,2021-04-26 16:50:49,2,/r/gaybros/comments/mzbi6x/the_gay_men_of_jerker_escape_aids_through_the/,NaN,
nxeolw,[IMPORTANT] Help the Russian AIDS Center,https://www.reddit.com/r/gaybros/comments/nxeolw/important_help_the_russian_aids_center/,Revolutionary_Utena,1,2021-06-11 05:21:13,0,/r/gaybros/comments/nxeolw/important_help_the_russian_aids_center/,Politics/News,"Parni PLUS, Russia's biggest LGBTQ-website, has been working since 2012. Every year 3,000,000 users visit Parni PLUS. The portal's publications cover the topics of health, relationships, lives and lifestyles of LGBTQ people.
On 1 December 2020, against the will of its creators and editors, Russia's Ministry of Justice included the portal into the register of foreign agents, i.e. the list of organisations involved in political activity and receiving funds from abroad.
On 20 May 2021, we, the Parni PLUS team, were fined for refusing to comply with the decision of the Ministry of Justice and for insisting that they cannot be treated as foreign agents because in fact they are not involved in any political activity. We have taken legal action and have filed a lawsuit against the government. We are fully aware we are bound to lose the case but it is a matter of principle for us.
After the website was included into the foreign agent registry, it was unlawfully banned by Roskomnadzor, Russia's Federal Service for Supervision of Communications, Information Technology and Mass Media which is the Russian federal executive body responsible for compliance with the law in media and telecommunications. In April, we managed to fight Roskomnadzor's decision in court and to get the website working again. However, after that we started receiving threats from far-right activists and unknown individuals who demand we shut down the website, otherwise they will cause us physical harm.
Right now we have to raise 300,000 roubles (4500 USD) by the end of July in order to continue working as a LGBTQ media outlet. Right now one more independent media outlet in Russia is at risk of extinction. Right now a reliable and vital source of information for Russian LGBTQ people is on the verge of dying out.
You can help us survive and continue fighting against homophobes and against governmental pressure by making a donation on our crowdfunding platform.

https://www.globalgiving.org/projects/saving-russias-leading-independent-lgbtq-media/"
oa6ohe,Remembering Outrage: Reading Susan Sontag’s “AIDS and Its Metaphors” in the Age of COVID-19,https://parisinstitute.org/remembering-outrage-reading-susan-sontags-aids-and-its-metaphors-in-the-age-of-covid-19/,steffrederik95,1,2021-06-29 04:50:01,2,/r/gaybros/comments/oa6ohe/remembering_outrage_reading_susan_sontags_aids/,NaN,
ou0k9a,"Hi all, for those who don’t know me, I am a PhD student in mental health neuroscience :) If you are interested, I made a research-based video (references in description) discussing how HIV &amp; later AIDS affects the body and brain. I hope some of you find it interesting :)",https://www.youtube.com/watch?v=RnEyv6W5BpM,ava_flava123,1,2021-07-29 09:13:41,8,/r/gaybros/comments/ou0k9a/hi_all_for_those_who_dont_know_me_i_am_a_phd/,Health/Body,
ovm602,KPIX 70: KPIX 5 Catches Up With Rita Rockett On World AIDS Day,https://www.youtube.com/watch?v=Vgpm1lgailY&amp;list=PLfRJXuif6tPc6OwyG8e6kVoT1wFo56hy-&amp;index=4,ChocolateTsar,1,2021-07-31 22:06:55,1,/r/gaybros/comments/ovm602/kpix_70_kpix_5_catches_up_with_rita_rockett_on/,Politics/News,
ox6th6,Just want to share a little i made for HIV/AIDS work i have done,https://youtu.be/jtgW5-UgfbI,WillowPractical3286,1,2021-08-03 09:15:56,2,/r/gaybros/comments/ox6th6/just_want_to_share_a_little_i_made_for_hivaids/,Coming Out,
